YOAF,Ruth Purvis,"Effects of 'pre-fracking' operations on ambient air quality at a shale gas exploration site in rural North Yorkshire, England",10.1016/j.scitotenv.2019.04.077,Science of the Total Environment,08/04/2019,OA fund,Paid,"Elsevier require CC BY license form to be completed, emailed author. 05/08/2019 MM. Chased again with Elsevier 10/12/2019 MM",493947593,"Apr 12, 2019 08:54:31",Chemistry,Journal article (Peer-reviewed original research article),Science of the Total Environment,Elsevier,NERC,NE/R017549/1,NERC,BGS,,,,Published,1879-1026,100% RCUK,,,"USD 3400, excluding taxes.",,,,,,,,"3,204.81",,,,,,,,,,,,,,,,,,,,,,,,,,,,CC BY-NC-ND
YOAF,Colin Beale,"African elephant poaching rates correlate with local poverty, national corruption and global ivory price",10.1038/s41467-019-09993-2,Nature Communications,28/05/2019,OA fund,Paid,,493953830,"Apr 12, 2019 09:51:44",Biology,Journal article (Peer-reviewed original research article),Nature Communications,Springer Nature,NERC,NE/N001370/1,,,,,,Accepted for publication,2041-1723,100% RCUK,,,"£3,490",,,,,,,,"4,188.00",,,,,,,,,,,,,,,,,,,,,,,,,,,,CC BY
YOAF,Robin Perutz,Benchmarking of Halogen Bond Strength in Solution with Nickel Fluorides: Bromine vs Iodine and Perfluoroaryl vs Perfluoroalkyl Donors,10.1002/chem.201900924,Chemistry  A European Journal,18/06/2019,Prepay,Paid,Sent stock Wiley prepay acount email. Waiting for Wiley automated email to approve. MM Journalled to UKRI 2019/20 9/9/19 JPC,493954934,"Apr 12, 2019 10:02:05",Chemistry,Journal article (Peer-reviewed original research article),Chemistry  A European Journal,Wiley,EPSRC,EP/J012955/1 and EP/J012998/1,,,,,,Accepted for publication,1521-3765,100% RCUK,Wiley prepay,,Eur 3500 - discount for University of York /selected UKRI funded papers,,,,,,,,"2,385.00",,,,,,,,,,,,,,,,,,,,,,,,,,,,CC BY
YOAF,Takahiro Ogasawara,In-plane and perpendicular exchange bias effect induced by an antiferromagnetic D019 Mn2FeGa thin film,10.1016/j.jmmm.2019.04.024,Journal of Magnetism and Magnetic Materials,13/04/2019,OA fund,Paid,"Affiliation confirmed - received invoice through Elsevier chasing it. Processed it 18/6/19 and emailed Guelvi explaining circumstances - HC // Checking affliation with author, no longer at York University? Author left Sep. 2018 but confirmed work for paper completed while at York MM 15/4/19. CC BY license form not completed by author - form sent to author by Elsevier 11/12/2019 MM",494037503,"Apr 12, 2019 17:07:51",Electronic Engineering,Journal article (Peer-reviewed original research article),Journal of Magnetism and Magnetic Materials,Elsevier,EPSRC,EP/M02458X/1,,,,,,Accepted for publication,1873-4766,100% RCUK,,,3186.0 USD,,,,,,,,"2,895.98",,,,,,,,,,,,,,,,,,,,,,,,,,,,CC BY-NC-ND
YOAF,Will Brackenbury,Emerging roles for multifunctional ion channel auxiliary subunits in cancer,10.1016/j.ceca.2019.04.005,Cell Calcium,25/04/2019,OA fund,Paid,,494941281,"Apr 16, 2019 19:28:12",Biology,Journal article (Peer-reviewed review article not commissioned by the journal),Cell Calcium,Elsevier,BBSRC,BB/M011151/1,,,,,,Submitted for publication,1532-1991,100% RCUK,,,USD 3450,,,,,,,,"3,299.68",,,,,,,,,,,,,,,,,,,,,,,,,,,,CC BY
YOAF,Simon Duckett,Reaction monitoring using SABRE-hyperpolarized benchtop (1 T) NMR spectroscopy,10.1021/acs.analchem.9b00729,Analytical Chemistry,21/05/2019,OA fund,Paid,"Article published online and deposited in PMC, not CCBY no invoice, flagged with TB DR 29/10/2019  Invoice received on 13/11/2019. Author had not completed paperwork. DR 13/11/19 ACS Discount, no pre pay . DR 13/11/19 COAF total moved to COAF 19/20 as invoice not processed intime for report. DR 26/11/2019",495102294,"Apr 17, 2019 10:07:08",Chemistry,Journal article (Peer-reviewed original research article),Analytical Chemistry,American Chemical Society (ACS),Wellcome Trust,092506 and 098335,EPSRC,EP/M020983/1,,,,Accepted for publication,1520-6882,50-50 split,,,$2000,,,,,,,,"2,028.96",,,,,,,,,,,,,,,,,2028.96,,,,,,,,,PMC6892580,30985110,CC BY
YOAF,Rosie Lennon,Using long-term datasets to assess the impacts of dietary exposure to neonicotinoids on farmland bird populations in England,10.1371/journal.pone.0223093,PLOS ONE,01/10/2019,OA fund,Paid,Requested invoice with pre-invoice email. 17/10/19 MM,495135172,"Apr 17, 2019 13:30:56",Environment and Geography,Journal article (Peer-reviewed original research article),PLOS ONE,PLOS,NERC,NE/L002450/1,,,,,RSPB are CASE partners for the NERC award and therefore contribute to research funds associated with this project.,Submitted for publication,1932-6203,100% RCUK,,,"$1,595 USD",,,,,,,,"1,526.27",,,,,,,,,,,,,,,,,,,,,,,,,,,,CC BY
YOAF,Mathilde Maitrot,Qualitative exploration of factors affecting progress in antipoverty interventions: Experiences from a poverty-reduction program in Bangladesh,10.1080/23311886.2019.1602986,Cogent Social Sciences,16/04/2019,OA fund,Paid,,496446224,"Apr 23, 2019 15:47:01",Social Policy and Social Work,Journal article (Peer-reviewed original research article),Cogent Social Sciences,Taylor & Francis (T&F),ESRC,ES/P010245/1,,,,,,Published,2331-1886,100% RCUK,,,675,,,,,,,,810,,,,,,,,,,,,,,,,,,,,,,,,,,,,CC BY
YOAF,Kirsty High,New approaches using mass spectrometry to investigate changes to cytokinin and abscisic acid (ABA) concentrations in soil,10.1016/j.soilbio.2019.04.017,Soil Biology and Biochemistry,23/04/2019,OA fund,Paid,,497325653,"Apr 24, 2019 20:41:52",Chemistry,Journal article (Peer-reviewed original research article),Soil Biology and Biochemistry,Elsevier,NERC,NE/M000648/1,,,,,,Accepted for publication,1879-3428,100% RCUK,,,3550 USD,,,,,,,,"3,194.62",,,,,,,,,,,,,,,,,,,,,,,,,,,,CC BY
Offset credit,Ian Bancroft,The impact of reducing fatty acid desaturation on the composition and thermal stability of rapeseed oil,10.1111/pbi.13263,Plant Biotechnology Journal,25/09/2019,Offset credit,Paid,"On Wiley dashboard 30/04/2019. Contacted Ian re. funder information etc. 30/04/19 EH. Second Wiley request sent through 15/7/19, approved. MM Fully OA journal - added payment date of 17 Sept 2019 for UKRI report because that was date of acceptance. Wiley draw down funds for fully OA journals on acceptance. MH 10/8/2020",500824844,"Apr 30, 2019 14:35:04",Biology,Journal article (Peer-reviewed original research article),Plant Biotechnology Journal,Wiley,BBSRC,BB/M028534/1 and BB/P012663/1,,,,,,Submitted for publication,1467-7652,100% RCUK,Wiley credit,,£1425 + VAT,,,,,,,,0,,,,,,,,,,,,,,,,,,,,,,,,,,,,CC BY
YOAF,Hong Gao,Integrating Vectors for Genetic Studies in the Rare Actinomycete Amycolatopsis marina,10.1186/s12896-019-0521-y,BMC Biotechnology,04/06/2019,OA fund,Paid,,500858469,"Apr 30, 2019 15:39:12",Biology,Conference proceedings paper (Peer-reviewed original research paper),BMC Biotechnology,BioMed Central (BMC),BBSRC,BB/K003356/1,,,,,"One of the authors, Buvani Murugesan, received a summer studentship from the Department of Biology, University of York.",Accepted for publication,1472-6750,100% RCUK,Sage discount,,GBP 1164.5 / EUR 1483.25 / USD 1823.25 (this value does not include any local taxes),,,,,,,,"1,457.40",,,,,,,,,,,,,,,,,,,,,,,,,,,,CC BY
Offset credit,Paul Walton,The Molecular Mechanisms of Oxygen Activation and Hydrogen Peroxide Formation in Lytic Polysaccharide Monooxygenases,,ACS Catalysis,,Offset credit,Paid,"Checked with TB, this title has now been included in ACS deal and invoice no longer needs paying. DR Invoice received APC600034308 - cancelled by ACS and finance, note added to invoice in folder DR 30/05/2019",500860879,"Apr 30, 2019 15:46:06",Chemistry,Journal article (Peer-reviewed original research article),ACS Catalysis,American Chemical Society (ACS),BBSRC,BB/R007705/1,,,,,,Accepted for publication,2155-5435,100% RCUK,ACS OA credit,,US$5000,,,,,,,,,,,,,,,,,,,,,,,,,,,,,,,,,,,,
Offset credit,Christopher Ridgers,Optimal Parameters for Radiation Reaction Experiments,10.1088/1361-6587/ab20f6,Plasma Physics and Controlled Fusion,11/06/2019,Offset credit,Paid,Eligible but contacting author as unable to verify grant codes JM 01/05/2019,501108246,"May 1, 2019 11:31:19",Physics,Journal article (Peer-reviewed original research article),Plasma Physics and Controlled Fusion,Institute of Physics (IOP),EPSRC,EP/M018156/1,,,,,,Accepted for publication,1361-6587,100% RCUK,IOP rebate,,"£1,960",,,,,,,,"2,352.00",,,,,,,,,,,,,,,,,,,,,,,,,,,,CC BY
YOAF,Umar Toseeb,Using Polygenic Profiles to Predict Variation in Language and Psychosocial Outcomes in Early and Middle Childhood,10.1044/2019_JSLHR-L-19-0001,"JOURNAL OF SPEECH, LANGUAGE, AND HEARING RESEARCH",20/09/2019,OA fund,Paid,"Moved to 20/21 DR - published with CCBY Sep 20, 2019.  No invoice received. Oct 2020. Marked as denied. DR (£1912.75).  Request for payment came from publisher 25/01/2021 due to publisher administrative error. TB agreed to pay, although probably will not be able to claim back from UKRI at this late stage. MM 05/02/2021. Sent reply to publisher payment chaser, see reply from publisher. 08/03/21 MM",501116753,"May 1, 2019 12:35:20",Education,Journal article (Peer-reviewed original research article),"JOURNAL OF SPEECH, LANGUAGE, AND HEARING RESEARCH",American Speech-Language-Hearing Association (ASLHA),ESRC,ES/P001955/1 & ES/P001955/2,,,,,,Accepted for publication,1558-9102,100% RCUK,,,"2,500 USD",,,,,,,,,1836.38,,,,,,,,,,,,,,,,,,,,,,,,,,31425657,CC BY
YOAF,Paul Genever,Multiplicity of mesenchymal stromal cells: Finding the right route to therapy,10.3389/fimmu.2019.01112,Frontiers in Immunology,16/05/2019,OA fund,Reported to funder,"Chased once reply 03/06/19 EH: All Frontiers in Immunology articles are deposited to PMC/PubMed upon publication. It takes 3 to 4 weeks for articles to be indexed in PMC/PubMed, although during busy periods there may be delays. I confirm that this article has been deposited and is being processed. If you cannot find this article on the PMC/PubMed website a month after publication, do not hesitate to contact us.  Checked, item in Pubmed / PMC 25/6/19 Updated sheet DR",501120324,"May 1, 2019 12:51:49",Biology,Journal article (Peer-reviewed review article not commissioned by the journal),Frontiers in Immunology,Frontiers,Versus Arthritis,19429,,,,,,Accepted for publication,1664-3224,100% COAF,,,USD 1850,,,,,,,,,,,,,,,,,,,,,,,1787.36,,,,,,,,,,,PMC6535495,31164890,CC BY
YOAF,Daniel Baker,Dynamic properties of internal noise probed by modulating binocular rivalry,10.1371/journal.pcbi.1007071,PLoS Computational Biology,06/06/2019,OA fund,Reported to funder,Eligible. Forwarded to Derryn re. COAF funds low. 07/05/19 EH. PLoS prepay - when automated email comes through ask James to transfer funds. MM 9/5/19 // On PLOS pre-invoice May 2019. Emailed James re transfer of funds.11/06/19 EH This article used the last of the prey pay funds $2040 prepay $310 invoiced on PAB243125 DR 20/08/2019. Balance on prepay £1931.97 journalled to COAF 9/9/19 JPC Split between COAF and Wellcome top up DR 22/11/19 emailed JC to ask to journal. Moved back to COAF 18/19 DR 26/11/19,502623264,"May 7, 2019 09:27:15",Psychology,Journal article (Peer-reviewed review article not commissioned by the journal),PLoS Computational Biology,PLOS,Wellcome Trust,105624,,,,,,Accepted for publication,1553-7358,100% COAF,,,$2350 (US dollars),,,,,,,,,,,,,,,,,,,,,,,"2,238.29",,,,,,,,,,,PMC6553697,31170150,CC BY
YOAF,Sara Stampacchia,"Control the source: Source memory for semantic, spatial and self-related
items in patients with LIFG lesions",10.1016/j.cortex.2019.04.014,Cortex,07/05/2019,OA fund,Reported to funder,"Eligible. Forwarded to Derryn re. COAF funds low. 07/05/19 EH. Will be deposited in PMC upon issue publication. MM 4/6/2019. Assigned to volume 119, Oct.2019. Chased again. 05/08/2019 MM Elsevier reply should be in PMC by end of this week. MM 13/11/19",502683204,"May 7, 2019 15:03:01",Psychology,Journal article (Peer-reviewed original research article),Cortex,Elsevier,Wellcome Trust,105624,,,,,,Accepted for publication,0010-9452,100% COAF,,,"Price: EUR 2,590.00 , Tax: EUR 518.00",,,,,,,,,,,,,,,,,,,,,,,2832.92,,,,,,,,,,,,31151086,CC BY
YOAF,Stefano Pirandola,Fundamental limits to quantum channel discrimination,10.1038/s41534-019-0162-y,npj Quantum Information,05/06/2019,OA fund,Paid,,502792434,"May 7, 2019 20:11:01",Computer Science,Journal article (Peer-reviewed original research article),npj Quantum Information,Springer Nature,EPSRC,EP/M013472/1,,,,,,Accepted for publication,2056-6387,100% RCUK,,,"£2,380",,,,,,,,"2,856.00",,,,,,,,,,,,,,,,,,,,,,,,,,,,CC BY
YOAF,Simon Duckett,"Pharmacokinetics of the SABRE agent 4,6-d2-Nicotinamide and also Nicotinamide in rats following oral and intravenous administration",10.1016/j.ejps.2019.05.004,European Journal of Pharmaceutical Sciences,09/05/2019,OA fund,Reported to funder,"Sent invoice for colour charges, emailed author as unable to pay under COAF rules. // Reply: I understand that this paper was funded by Wellcome Trust and this should be deposited to PubMed Central and Europe PubMed Central. From checking the system, I can confirm that the Rights and Access form was completed on May 8, 2019 and Gold open Access was selected for the the article under the CC BY license. Wellcome trust funding has been selected in the form and I wish to advise that the manuscript will be deposited timely in PubMed Central. The paper will be made available through PubMed Central (PMC) and Europe PubMed Central (Europe PMC) as soon as possible and in any event within six months of the journal publisher's official date of final publication. You may also find the below link useful, for reference: https://www.elsevier.com/about/open-science/open-access/agreements/elsevier-agreement-with-the-wellcome-trust 04/06/19 EH
 ",502976557,"May 8, 2019 12:18:50",Chemistry,Journal article (Peer-reviewed original research article),European Journal of Pharmaceutical Sciences,Elsevier,Wellcome Trust,092506 and 098335,,,,,,Accepted for publication,0928-0987,100% COAF,,,"£3,000",,,,,,,,,,,,,,,,,,,,,,,3303.25,,,,,,,,,,,PMC6556870,31077749,CC BY
YOAF,Wael Gorma,CFDAMA-SRR: A MAC Protocol for Underwater Acoustic Sensor Networks,10.1109/ACCESS.2019.2915929,IEEE ACCESS,09/05/2019,OA fund,Paid,"Noticed incorrect license when raising invoice with RightsLink. Emailed author. MM 09/05/2019. Invoice requested from CCC, please inform author when invoice arrives. MM 23/5/19",503351489,"May 9, 2019 12:15:24",Electronic Engineering,Journal article (Peer-reviewed original research article),IEEE ACCESS,Institute of Electrical and Electronic Engineering (IEEE),EPSRC,EP/P017975/1,EPSRC - Engineering & Physical Sciences Research Council,EP/R003297/1,,,,Accepted for publication,2169-3536,100% RCUK,,,"1,750.00 USD",,,,,,,,"1,713.34",,,,,,,,,,,,,,,,,,,,,,,,,,,,CC BY
Offset credit,David Shaw`,Modelling radio-frequency plasma cleaning of fusion optics,10.1088/1361-6587/ab2cb2,Plasma Physics and Controlled Fusion,11/07/2019,Offset credit,Paid,,504206237,"May 13, 2019 12:17:24",Physics,Journal article (Peer-reviewed review article not commissioned by the journal),Plasma Physics and Controlled Fusion,Institute of Physics (IOP),EPSRC,EP/L01663X/1,EPSRC - Engineering & Physical Sciences Research Council,EP/K018388/1,,,,Submitted for publication,1361-6587,100% RCUK,IOP rebate,,£1960 GBP,,,,,,,,"2,352.00",,,,,,,,,,,,,,,,,,,,,,,,,,,,CC BY
YOAF,Alessandro Pezzoni,A Jarník-type theorem for a problem of approximation by cubic polynomials,10.4064/aa180926-9-5,Acta Arithmetica,29/01/2020,OA fund,Paid,"author and grant code checks done, struggling to find OA/copyright licence info on publishers webpage as not eligible on SHERPA/FACT. HC // 'The article  can also be published in Open Access (that is, with the final print file also freely downloadable) upon paying a fee of 300 euros. The decision should be communicated at the proof stage; the appropriate invoice will then be sent to the author.' Checked our electronic subscription to journal; could not find mention of CC BY on published papers. libr539 sent to publisher: CCBY licence available? Reply: It is possible that an invoice to be issued contains reference to a CC BY License the article. Asking MH whether this is alright to approve. Replied: will CC BY be printed on published PDF? 14/05/19 EH Email confirming that CCBY will be attributed on pdf 15/05/2019 DR Invoice received 15/05/2019",504259502,"May 13, 2019 15:35:29",Mathematics,Journal article (Peer-reviewed original research article),Acta Arithmetica,Institute of Mathematics Polish Academy of Sciences,EPSRC,International Doctoral Scholars IDS Grant EP/N509802/1,,,,,,Accepted for publication,1730-6264,100% RCUK,,,300 EUR,,,,,,,,327.12,,,,,,,,,,,,,,,,,,,,,,,,,,,,CC BY
YOAF,Meghan Halse,"Towards measuring reactivity on micro-to-millisecond timescales with laser pump, NMR probe spectroscopy",10.1039/C9FD00039A,Faraday Discussions,11/06/2019,OA fund,Paid,,505158240,"May 16, 2019 14:02:10",Chemistry,Journal article (Peer-reviewed original research article),Faraday Discussions,Royal Society of Chemistry (RSC),EPSRC,EP/K022792/1,,,,,,Accepted for publication,1364-5498,100% RCUK,,,"£1,600",,,,,,,,"1,632.00",,,,,,,,,,,,,,,,,,,,,,,,,,,,CC BY
YOAF,Chris Neale,THE IMPACT OF WALKING IN DIFFERENT URBAN ENVIRONMENTS ON BRAIN ACTIVITY IN OLDER PEOPLE,10.1080/23748834.2019.1619893,Cities and Health,24/06/2019,OA fund,Paid,Author now left University. Checking if work completed for paper was done at York + duplicate request with id 385938560. MM 20/5/19 // Reply: confirmation work completed at York with colleague Steve Cinderby (still at York).  I can confirm it's the same work and we will only be publishing this with Cities and Health going forward. Added note/closed previous request. 20/05/19 EH // Completed approval following T&F email. 21/05/19 EH,505237547,"May 16, 2019 18:32:22",Environment and Geography,Journal article (Peer-reviewed original research article),Cities and Health,Taylor & Francis (T&F),EPSRC,EP/K037404/1,,,,,,Accepted for publication,2374-8842,100% RCUK,Taylor & Francis discount,,GBP 1995,,,,,,,,598.5,,,,,,,,,,,,,,,,,,,,,,,,,,,,CC BY
YOAF,Maggie Smith,Characterisation of the Streptomyces coelicolor glycoproteome reveals glycoproteins important for cell wall biogenesis,10.1128/mBio.01092-19,mBIO,25/06/2019,OA fund,Paid,Additional charge is for supplemental material fee. For Agresso report need to split costs between APC and additional charge. Use 9% of total against additional charge. Reverse charge VAT still to come. See email to JC 22/7/2019 'Agresso report 201811 query' for further info. MM. Reverse charge VAT added from 201812 Agresso Report. MR 10/10/2019,505826996,"May 19, 2019 16:03:57",Biology,Journal article (Peer-reviewed original research article),mBIO,American Society for Microbiology (ASM),BBSRC,BB/J016691/1,EPSRC - Engineering & Physical Sciences Research Council,EP/K039660/1; EP/M028127/1,,,"The first author, Tessa Keenan, was a PhD student at the University of York on a stipend funded by the University of York. She is now a post-doc in Chemistry.",Accepted for publication,2150-7511,100% RCUK,,,$3300,,,,,,,,"3,521.28",,,,,,,,,,,,,,,,,,,,,,,,,,,,CC BY
Offset credit,Stuart Grange,Strong temperature dependence for light-duty diesel vehicle NOx emissions,10.1021/acs.est.9b01024,Environmental Science & Technology,16/05/2019,Offset credit,Paid,,505978908,"May 20, 2019 13:33:23",Chemistry,Journal article (Peer-reviewed original research article),Environmental Science & Technology,American Chemical Society (ACS),,,,,,,,Accepted for publication,,,ACS OA credit,,0,,,,,,,,,,,,,,,,,,,,,,,,,,,,,,,,,,,,CC BY
YOAF,Keith McKenna,First principles investigation of Y2O3-doped HfO2,10.1063/1.5110669,Journal of Applied Physics,27/08/2019,OA fund,Paid,Paid by credit card. OA APC payment AIP Publishing JAP19-AR-03035 on date 10 08 2019 by Sarah Thompson,505994593,"May 20, 2019 14:39:26",Physics,Journal article (Peer-reviewed original research article),Journal of Applied Physics,American Institute of Physics (AIP),EPSRC,EP/K003151/1,,,,,,Submitted for publication,1089-7550,100% RCUK,,,2200 USD,,,,,,,,"2,237.81",,,,,,,,,,,,,,,,,,,,,,,,,,,,CC BY
YOAF,Steph Lawler,‘I Couldn’t Say the Words’: Communicative Bodies and Spaces in Parents' Encounters with Nonsuicidal Self-Injury,10.1057/s41285-020-00144-y,Social Theory and Health,17/06/2020,OA fund,Paid,"libr539 sent to publisher 21/05/19: CC BY available? immediate deposit to PMC? (Publisher website: authors subject to CC BY requirements should contact the journal editorial office to request use of a CC BY licence prior to publication.) If confirmed, email Steph for grant code as what appears to be a workorder number has been given. EH Reply from Palgrave ' If accepted for publication, CC BY licence available with payment of APC. Author retains rights to paper when published so can deposit themselves to PubMed with no embargo upon publication. Contacted author re. grant code. MM 29/5/19. If approved pls inform author they will need to deposit to PubMed themselves. MM. Author emailed stating paper has now been accepted for publication and that the invoice will arrive addressed to author's name with UoY address. Checked with DR and this is fine. MR 10/06/2020 Steph has forwarded invoice on - as German vendor, VAT has mistakenly been added. Email sent to publisher to get this updated. MR 14/08/2020 Invoice updated and now processed. MR 18/08/2020. Not deposited to PMC check publisher policy. MM 19/10/20 Emailed Springer customer support to see if they could deposit this to PMC. (MH 30/11/2020).",505995959,"May 20, 2019 14:44:27",Sociology,Journal article (Peer-reviewed original research article),Social Theory and Health,Springer Nature,Wellcome Trust,201617/Z/16/Z,,,,,,Submitted for publication,1477-822X,100% COAF,,,1600 GBP,,,,,,,,,,,,,,,,,,,,,,,,,284.79,1959.21,,,,,,,,,,CC BY
YOAF,Prof. Mark Leake,Single-Organelle Quantification Reveals Stoichiometric and Structural Variability of Carboxysomes Dependent on the Environment,10.1105/tpc.18.00787,The Plant Cell,10/07/2019,OA fund,Paid,Waiting for reply from Thom. DR 22/5/19 Agreed that article can only be funded by UKRI as publisher isn't Wellcome or MRC compliant. I have emailed the author to let them know about this. Please log APC as 100% UKRI DR 28/05/2019 Request to split cost 50/50 with University of Liverpool. I am talking to James about what we need to do next. DR 10/6/19 JC created PO line 806995. Invoice received from Sue Corkhill at Liverpool.ac.uk £840.34 DR,506514611,"May 22, 2019 09:37:02",Physics,Journal article (Peer-reviewed original research article),The Plant Cell,American Society of Plant Biologists,MRC,MR/K01580X/1,BBSRC - Biotechnology & Biological Sciences Research Council,BB/M024202/1,BBSRC - Biotechnology & Biological Sciences Research Council,BB/N006453/1,"BBSRC BB/R003890/1
Wellcome Trust part funded from grant 204829",Accepted for publication,1532-298X,100% RCUK,,,USD2100 - note this value reflects 50% of the total fee with the other half shared by the co-corresponding author,,,,,,,,840.34,,,,,,,,,,,,,,,,,,,,,,,,,,,31048338,CC BY
YOAF,Myat Aung,The Trails of Just Cause: Spatio-Temporal Player Profiling in Open-World Games,10.1145/3337722.3337765,International Conference Proceeding Series (ICPS): FDG '19: Proceedings of the 14th International Conference on the Foundations of Digital Games,26/08/2019,OA fund,Paid,"To be published in ACM Digital Library: The Fourteenth International Conference on the Foundations of Digital Games Sent query to Thom 23/5/19 MM. OK to approve. MM. Full ACM APC charge usually $900 for non-ACM members, check on membership if less. See MM. Not published under CC BY, to query with ACM. MM 28/2/20. States OA on website with © 2019 Owner/Author but no reference to CC BY. PDF not CC BY and has © 2019 Association for Computing Machinery - chasing with ACM. MM 8/6/20",506578481,"May 22, 2019 15:41:59",Computer Science,Conference proceedings paper (Peer-reviewed original research paper),International Conference Proceeding Series (ICPS): FDG '19: Proceedings of the 14th International Conference on the Foundations of Digital Games,Association for Computing Machinery (ACM),EPSRC,EP/L015846/1,EPSRC - Engineering & Physical Sciences Research Council,EP/M023265/1,,,,Accepted for publication,,100% RCUK,,,$700 or $900,,,,,,,,875.52,,,,,,,,,,,,,,,,,,,,,,,,,,,,CC BY
YOAF,Susan Stepney,A Substrate-Independent Framework to Characterise Reservoir Computers,10.1098/rspa.2018.0723,Proceedings of the Royal Society A,19/06/2019,OA fund,Paid,,506866711,"May 23, 2019 15:02:52",Computer Science,Journal article (Peer-reviewed original research article),Proceedings of the Royal Society A,The Royal Society,EPSRC,EP/R032823/1,,,,,part funded by DSTL PhD studentship,Accepted for publication,1471-2946,100% RCUK,,,"£1,275",,,,,,,,"1,530.00",,,,,,,,,,,,,,,,,,,,,,,,,,,,CC BY
YOAF,Jim McCambridge,Understanding public opinion to the introduction of Minimum Unit Pricing in Scotland: a qualitative study using Twitter,10.1136/bmjopen-2019-029690,bmj open,"June 14, 2019",Prepay,Reported to funder,BMJ Prepay account. When quarterly report comes through ask James to transfer funds from COAF to RCUK. MM Asked JC to journal charges DR 11/11/19 Journalled charge to COAF as at 31/10 JPC,507150923,"May 24, 2019 16:28:31",Health Sciences,Journal article (Peer-reviewed original research article),bmj open,British Medical Journal (BMJ),Wellcome Trust,200321/Z/15/Z,,,,,,Accepted for publication,2044-6055,100% COAF,BMJ prepay,,"£1,620",,,,,,,,,,,,,,,,,,,,,,,,1377,,,,,,,,,,PMC6576115,31201194,CC BY
