YOAF,Keith McKenna,"Structure, electronic properties and oxygen incorporation/diffusion characteristics of the Sigma 5 TiN(310)[001] tilt grain boundary",10.1063/1.5016626,Journal of Applied Physics,Feb-18,OA fund,Reported to funder,,366372338,"Nov 21, 2017 13:04",Physics,Journal Article (peer reviewed),Journal of Applied Physics,American Institute of Physics (AIP),EPSRC,"EP/K003151, EP/P006051/1 and EP/P023843/1",,,,,Keith McKenna,Submitted for publication,1089-7550,100% RCUK,,,2200 USD,,,,,,1936.75,,,,,,,,,,,,,,,,,,,,,,,,,,,,,,CC BY
YOAF,Karen Parkhill,Rethinking energy demand governance: Exploring impact beyond energy policy,10.1016/j.erss.2017.11.011,Energy Research and Social Science,26/12/2017,OA fund,Reported to funder,libr539 03/12/17: expect invoice within 5 days. EH Invoice received (Dated 06/12/17)but with wrong billing address-libr539 email sent to Elsevier asking to correct it JM 14/12/17,366611184,"Nov 22, 2017 10:30",Environment and Geography,Journal Article (peer reviewed),Energy Research and Social Science,Elsevier,EPSRC,EP/M008150/1,,,,,,Accepted for publication,2214-6296,100% RCUK,,,2500 USD,,,,,,2429.3,,,,,,,,,,,,,,,,,,,,,,,,,,,,,,CC BY
YOAF,Paul Fogg,"Recombination directionality factor gp3 binds ϕC31 integrase via the zinc domain, potentially affecting the trajectory of the coiled-coil motif",10.1093/nar/gkx1233,Nucleic Acids Research,08/12/2017,OA fund,Reported to funder,Inv. E11439042 received 11/12/2017 15/12 Pages charges invoice matched JPC. Page charges reported on Agresso 201705-4378310 but OA charges not on Agresso yet JM 31/01/18,366621075,"Nov 22, 2017 12:00",Biology,Journal Article (peer reviewed),Nucleic Acids Research,Oxford University Press (OUP),BBSRC,BB/K003356/1,,,,,,Accepted for publication,1362-4962,100% RCUK,,,£710,,,,,,1332,,,,,,,,,,,,,,,,,,,,,,,,,,,,,29228292,CC BY
YOAF,Patrick Doherty,Does the mode of delivery in Cardiac Rehabilitation determine the extent of psychosocial health outcomes?,10.1016/j.ijcard.2017.11.056,INTERNATIONAL JOURNAL OF CARDIOLOGY,15/03/2018,OA fund,Reported to funder,See email correspondence re invoice to be reissued. 23/11/17 MM Not published yet (31/01/18)-please check later if article is published with cc-by licence and add details JM,366629801,"Nov 22, 2017 13:10",Health Sciences,Journal Article (peer reviewed),INTERNATIONAL JOURNAL OF CARDIOLOGY,Elsevier,British Heart Foundation,"R1680901, R1874801  0263",,,,,,Accepted for publication,1874-1754,100% COAF,,,EUR 3552.35,,,,,,,,,,,,,,,,,,,,,3191.69,,,,,,,,,,,,,PMC5809024,29425551,CC BY
YOAF,Nils Morozs,TDA-MAC: TDMA Without Clock Synchronization in Underwater Acoustic Networks,10.1109/ACCESS.2017.2777899,IEEE Access,27/11/2017,OA fund,Paid,"Why has this not appeared on our IEEE prepay statement? MH 21/5/18  IEEE confirmed that this has not yet been added to our prepay because there was not enough money in the prepay. Asked IEEE to forward us an invoice. I set this line back from 'paid' to 'confirmed accepted' for this reason. When we get an invoice, it needs to be paid in the normal way. MH 20/5/18 Appeared on Aug 2018 prepay report - asked IEEE to invoice us (MH 25/9/2018)",366862279,"Nov 23, 2017 15:24",Electronic Engineering,Journal Article (peer reviewed),IEEE Access,Institute of Electrical and Electronic Engineering (IEEE),EPSRC,EP/P017975/1,,,,,,Accepted for publication,2169-3536,100% RCUK,,,"1,995 USD inc. VAT",,,,,,,1676.17,,,,,,,,,,,,,,,,,,,,,,,,,,,,,CC BY
YOAF,Jennifer Sumner,Does service timing matter for psychological outcomes in cardiac rehabilitation? Insights from the National Audit of Cardiac Rehabilitation,10.1177/2047487317740951,European Journal of Preventative Cardiology,09/11/2017,Prepay,Reported to funder,,366921312,"Nov 24, 2017 03:15",Health Sciences,Journal Article (peer reviewed),European Journal of Preventative Cardiology,SAGE,British Heart Foundation,NACR research,,,,,,Published,20474881,100% COAF,Sage prepay,,"£1,600",,,,,,,,,,,,,,,,,,,,,480,,,,,,,,,,,,,PMC5757407,29120237,CC BY
YOAF,Hugh MacPherson,An Economic Evaluation of Alexander Technique Lessons or Acupuncture Sessions for Patients with Chronic Neck Pain: a Randomized Trial (ATLAS),10.1371/journal.pone.0178918  The Digital Object Identifier (DOI) System enables identification of digital entities,PLoS One,06/12/2017,Prepay,Reported to funder,"Cost reported to Wellcome based on older exchange rate (£1465.45), cost on plos balance sheet is £1395.42 (05/12/2018,TB).",366955531,"Nov 24, 2017 10:01",Health Sciences,Journal Article (peer reviewed),PLoS One,PLOS,Arthritis Research UK,19702,,,,,,Accepted for publication,1932-6203,100% COAF,PLoS prepay,,"US$1,495",,,,,,,,,,,,,,,,,,,,,1465.45,,,,,,,,,,,,,PMC5718562,29211741,CC BY
YOAF,Professor Michael North,Capacitance Assisted Sustainable Electrochemical Carbon Dioxide Mineralisation,10.1002/cssc.201702087,ChemSusChem,24/11/2017,Prepay,Reported to funder,,366959173,"Nov 24, 2017 10:36",Chemistry,Journal Article (peer reviewed),ChemSusChem,Wiley,EPSRC,EP/L505122,EPSRC,EP/M508196/1,EPSRC,EP/N509802/1,,Accepted for publication,1864-564X,100% RCUK,Wiley prepay,,2500 Euro,,,,,,1800,,,,,,,,,,,,,,,,,,,,,,,,,,,,,,CC BY
YOAF,Anders Drachen,Player Retention In League of Legends: A Study Using Survival Analysis,10.1145/3167918.3167937,Proceedings of the 2018 Australasian Computer Science Week,29/01/2018,OA fund,Paid,"Checking eligibility: libr539 to ACM - CCBY licence? Spoke to Matthew: RCUK funding fine. Eligibility depends on whether ACM use CC-BY licences.If affirmative we can proceed. EH 28/11/17. Email forwarded by author confirms that CC-BY is an option, contacted author to confirm eligibility. TB 30/11/17. // libr539 23/04/18: Anders sent through the invoice but the address details are not formatted to our specification.  Asked him to contact the publisher to obtain a new invoice with the correct details. EH // I contacted ACM requesting a new invoice with an amendment to the address. 24/04/18 EH // Chased ACM10/07/18 EH. ACM sent invoice but did not include invoice number, requested this from them. 12/7/18 MM Liscence=Open Access but no info on which licence- ""Permission to make digital or hard copies of part or all of this work for personal or classroom use is granted without fee provided that copies are not made or distributed for profit or commercial advantage and that copies bear this notice and the full citation on the first page. Copyrights for third-party components of this work must be honored. For all other uses, contact the owner/author(s).© 2018 Copyright held by the owner/author(s)."" Chasing with ACM as CC-BY liscence not applied, but publishers claim none payment-contacted James JM 01/05/19",367507637,"Nov 27, 2017 22:02",Computer Science,Conference Paper (peer reviewed),Proceedings of the 2018 Australasian Computer Science Week,Association for Computing Machinery (ACM),EPSRC,EP/M023265/1.,,,,,,Accepted for publication,1530-0900,100% RCUK,,,900 USD,,,,,,,856.17,,,,,,,,,,,,,,,,,,,,,,,,,,,,,Unknown
YOAF,Kelly R Redeker,Microbial metabolism directly affects trace gases in (Sub) Polar snowpacks,10.1098/rsif.2017.0729,Journal of the Royal Society: Interface,20/12/2017,OA fund,Reported to funder,,367944162,"Nov 29, 2017 15:36",Biology,Journal Article (peer reviewed),Journal of the Royal Society: Interface,The Royal Society,NERC,NE/H014446/1,,,,,,Accepted for publication,1742-5662,100% RCUK,Royal Society discount,,"£1,700",,,,,,1530,,,,,,,,,,,,,,,,,,,,,,,,,,,,,,CC BY
YOAF,"Thompson, Hannah",The contribution of executive control to semantic cognition: Convergent evidence from semantic aphasia and executive dysfunction,10.1111/jnp.12142,Journal of Neuropsychology,Version of record online 03/01/2018; issue online 03/06/18. Expect PMC two weeks after issue online. libr539 12/06/18 EH,Prepay,Reported to funder,"Request came through via wiley OA dashboard, confimed with co-author Beth Jeffries that they wanted funding-H.Thompson had submitted request but via old form so didn't come through automatically here. JM 01/12/17. Still early online (not yet version of record) so not yet on PMC (MH 23/4/18) Chased 08/06/18 JM // Reply 12/06/18: It takes two weeks’ time for an article to appear in PMC, after the issue publication. This article was published in issue last week. If it is not appearing in PMC by early next week, I will then check with the respective team on the status. EH",,01/12/2017,Psychology,Journal Article (peer reviewed),Journal of Neuropsychology,Wiley,Wellcome Trust,105624,MRC,MR/J004146/1,,,"K.A.N. (external co-author) was supported by a studentship from the Medical Research Council, M.A.L.R. (external co-author)by a Medical Research Council programme grant (MR/J004146/1)",Accepted for publication,1748-6653,50-50 split,Wiley prepay,,"£1,667",,,,,,750.15,,,,,,,,,,,,,,,750.15,,,,,,,,,,,,,6001665,29314772,CC BY
YOAF,James Chong,A practical introduction to microbial molecular ecology through the use of iChips,,Ecology and Evolution,NYP,Prepay,Reported to funder,,368442079,"Dec 1, 2017 13:02",Biology,Journal Article (peer reviewed),Ecology and Evolution,Wiley,EPSRC,EP/M028208/1,,,,,,Submitted for publication,2045-7758,100% RCUK,Wiley prepay,,1295 GBP,,,,,,1165.2,,,,,,,,,,,,,,,,,,,,,,,,,,,,,,
YOAF,Martin Fascione,Palladium-unleashed proteins: gentle aldehyde decaging for site-selective protein modification,10.1039/C7CC07740H,Chemical Communications,24/01/2018,OA fund,Reported to funder,,369698371,"Dec 7, 2017 01:40",Chemistry,Journal Article (peer reviewed),Chemical Communications,Royal Society of Chemistry (RSC),EPSRC,EP/M506680/1,,,,,,Accepted for publication,1364-548X,100% RCUK,RSC discount,,unknown,,,,,,1020,,,,,,,,,,,,,,,,,,,,,,,,,,,,,,CC BY
YOAF,Simon Duckett,Achieving biocompatible SABRE: An in vitro cytotoxicity study,10.1002/cmdc.201700725,ChemMedChem,12/12/2017,Prepay,Reported to funder,,369791360,"Dec 7, 2017 13:24",Chemistry,Journal Article (peer reviewed),ChemMedChem,Wiley,Wellcome Trust,092506 and 098335,,,,,,Accepted for publication,1860-7179,100% COAF,Wiley prepay,,4000,,,,,,,,,,,,,,,,,,,,,1800,,,,,,,,,,,,,PMC5838797,29232489,CC BY
YOAF,David Orton,A tale of two tells: dating the Çatalhöyük West Mound,,Antiquity,NYP,OA fund,Reported to funder,Author emailed as could not find grant code. JM 07/12/2017 Author confimed grant code 08/12/17 JM,369809551,"Dec 7, 2017 14:50",Archaeology,Journal Article (peer reviewed),Antiquity,Cambridge University Press (CUP),AHRC,NF/2012/2/10,NERC,NF/2012/2/10,,,"This is a joint AHRC/NERC scheme for use of the NERC Radiocarbon Facility. In our case the funding came from AHRC, but the scheme is administered by NERC.",Accepted for publication,1745-1744,100% RCUK,,,£1000 exc. VAT,,,,,,1409.38,,,,,,,,,,,,,,,,,,,,,,,,,,,,,,
YOAF,Anders Drachen,Analyzing Player Networks in Destiny,10.1016/j.entcom.2017.12.001,Entertainment Computing,12/12/2017,OA fund,Reported to funder,,370844404,"Dec 12, 2017 13:46",Computer Science,Journal Article (peer reviewed),Entertainment Computing,Elsevier,EPSRC,EP/M023265/1,,,,,,Accepted for publication,1875-953X,100% RCUK,,,2400 US dollar,,,,,,2321.02,,,,,,,,,,,,,,,,,,,,,,,,,,,,,,CC BY
YOAF,Simon Duckett,Using 2H Labelling to Improve the NMR Detectability of Pyridine and its Derivatives by SABRE,10.1002/mrc.4703,Magnetic Resonance in Chemistry,25/01/2018,Prepay,Reported to funder,Still early online (not yet version of record) so not yet on PMC (MH 23/4/18) Chased 08/06/18 JM // Reply: on PMC 12/06/18 EH,370908443,"Dec 12, 2017 17:35",Chemistry,Journal Article (peer reviewed),Magnetic Resonance in Chemistry,Wiley,Wellcome Trust,092506 and 098335,,,,,,Accepted for publication,1097-458X,100% COAF,Wiley prepay,,2000,,,,,,,,,,,,,,,,,,,,,1980,,,,,,,,,,,,,6001449,29274294,CC BY
YOAF,John N Moore,Considerations in the determination of orientational order parameters from X-ray scattering experiments,10.1080/02678292.2018.1455227,Liquid Crystals,27/03/2018,Prepay,Reported to funder,,371631576,"Dec 15, 2017 10:42",Chemistry,Journal Article (peer reviewed),Liquid Crystals,Taylor & Francis (T&F),EPSRC,EP/M020584/1,EPSRC,EP/K039660/1,,,,Submitted for publication,1366-5855,100% RCUK,Taylor & Francis prepay,,£1788 (GBP),,,,,,536.4,,,,,,,,,,,,,,,,,,,,,,,,,,,,,,CC BY
YOAF,Anders Drachen,What Moves Players? Visual Data Exploration of Twitter and Gameplay Data,10.1145/3173574.3174134,2018 ACM Conference on Human Factors in Computing Systems (CHI'18),2018,OA fund,Reported to funder,,371975481,"Dec 17, 2017 10:56",Computer Science,Conference Paper (peer reviewed),2018 ACM Conference on Human Factors in Computing Systems (CHI'18),Association for Computing Machinery (ACM),EPSRC,EP/M023265/1,,,,,,Accepted for publication,,100% RCUK,,,900 USD.,,,,,,802.74,,,,,,,,,,,,,,,,,,,,,,,,,,,,,,CC BY
YOAF,Miles Whittington,Enhanced interlaminar excitation or reduced superficial layer inhibition in neocortex generates different spike and wave-like electrographic events in vitro.,10.1152/jn.00516.2017,Journal of Neurophysiology,01/01/2018,OA fund,Reported to funder,Paid £1524.69 by cc 4/1/18 JPC,372134004,"Dec 18, 2017 12:53",Hull York Medical School,Journal Article (peer reviewed),Journal of Neurophysiology,American Physiological Society (APS),Wellcome Trust,98352,,,,,,Accepted for publication,1522-1598,100% COAF,,,USD2505,,,,,,,,,,,,,,,,,,,,,1805.87,,,,,,,,,,,,,PMC5866469,28954894,CC BY
YOAF,Alister Burr,Robust User Scheduling with COST 2100 Channel Model for Massive MIMO Networks,10.1049/iet-map.2017.0332,"IET Microwaves, Antennas & Propagation",19/04/2018,OA fund,Paid,Author: Manijeh Bashar <mb1465@york.ac.uk // libr539 email from Alister: payment request.  Invoice service currently down so could not check invoice details. Notified Alister that we would check again. 19/04/18 EH,372422108,"Dec 19, 2017 15:58",Electronic Engineering,Journal Article (peer reviewed),"IET Microwaves, Antennas & Propagation",Institution of Engineering and Technology (IET),EPSRC,EP/K040006/1,,,,,,Accepted for publication,1751-8733,100% RCUK,,,USD 2000,,,,,,,1829.55,,,,,,,,,,,,,,,,,,,,,,,,,,,,,CC BY
YOAF,Victor Beresnevich,A Mass Transference Principle for systems of linear forms and its applications,10.1112/S0010437X18007121,Compositio Mathematica,03/04/2018,OA fund,Reported to funder,,,20/12/2017,Mathematics,Journal Article (peer reviewed),Compositio Mathematica,Cambridge University Press (CUP),EPSRC,EP/J018260/1 And EP/M506680/1,,,,,,,1570-5846,100% RCUK,,,"£1,775",,,,,,2595.31,,,,,,,,,,,,,,,,,,,,,,,,,,,,,,CC BY
YOAF,Nisha Kapoor,"Unmaking Citizens: Passport Removals, Pre-emptive Policing and the Remaking of Colonial Governmentalities",10.1080/01419870.2017.1411965,Ethnic and Racial Studies,20/12/2017,Prepay,Reported to funder,,372731884,"Dec 20, 2017 19:58",Sociology,Journal Article (peer reviewed),Ethnic and Racial Studies,Taylor & Francis (T&F),ESRC,ES/L009447/1,,,,,,Published,1466-4356,100% RCUK,Taylor & Francis prepay,,Not sure,,,,,,536.4,,,,,,,,,,,,,,,,,,,,,,,,,,,,,,CC BY
YOAF,Sarah Nettleton,Envisioning Bodies And Architectures Of Care: Reflections On Competition Designs For Older People,10.1016/j.jaging.2018.01.008,Journal of Aging Studies,04/05/2018,OA fund,Reported to funder,"Fee taken from Elsevier OA price list online + VAT. MM 21/12/17 // Chasing publisher about wrong licence. libr539 12/06/18 EH //19/06/18 EH: CC-BY licence agreement form to be completed before system can be updated. Forwarded to author. // After a prolonged exchange of emails, changed to CC BY. 03/07/18 EH",372845139,"Dec 21, 2017 09:08",Sociology,Journal Article (peer reviewed),Journal of Aging Studies,Elsevier,ESRC,ES/M008398/1,,,,,,Accepted for publication,1879-193X,100% RCUK,,,As far as I know not applicable,,,,,,1721.93,,,,,,,,,,,,,,,,,,,,,,,,,,,,,29735211,CC BY
YOAF,Nathalie Signoret,A correlative and quantitative imaging approach enabling characterization of primary cell-cell junctions: Case of human CD4+ T cell-macrophage immunological synapses.,10.1038/s41598-018-26172-3,Scientific reports,22/05/2018,OA fund,Paid,"Emailed Research Student Administration Team regarding grant code JM 22/12/17 // Emailed author to confirm title-submitted as ""F"" on online form. // Updated 02/01/18 EH",372927454,"Dec 21, 2017 17:22",Biology,Journal Article (peer reviewed),Scientific reports,Springer Nature,BBSRC,BB/F016751/1,,,,,,Submitted for publication,2045-2322,100% RCUK,,,"£1,165.00",,,,,,,1398,,,,,,,,,,,,,,,,,,,,,,,,,,,,,CC BY
YOAF,Daniel Ungar,Glycans modify mesenchymal stem cell differentiation to impact the function of resulting osteoblasts,10.1242/jcs.209452,Journal of Cell Science,14/02/2018,OA fund,Reported to funder,Emailed Research Student Administration Team to get RCUK grant code. 4/1/18 MM. Not on PMC 23/4/18 - emailed jcs@biologists.com to get it deposited (MH 23/4/2018) // ON PMC 08/06/18 JM,375015625,"Jan 3, 2018 13:24",Biology,Journal Article (peer reviewed),Journal of Cell Science,Company of Biologists (COB),Arthritis Research UK,19429,EPSRC,PhD studentship - Katherine Wilson EP/J500598/1,,,,Accepted for publication,1477-9137,50-50 split,,,£2500 + VAT,,,,,,1651.61,,,,,,,,,,,,,,,1651.62,,,,,,,,,,,,,PMC5868951,29361539,CC BY
YOAF,Dr Victoria Hodge,How the Business Model of Customisable Card Games Influences Player Engagement,10.1109/TG.2018.2803843,IEEE Transactions on Computational Intelligence and AI in Games (T-CIAIG),12/03/2018,OA fund,Paid,"Author received email from IEEE stating that they have requested open access payment for this article and that payment has not been received. We have not received the usual automatic email from IEEE asking us to confirm that we will cover the costs-emailed IEEE to ask for confirmation it will be added to our prepay account 21/02/18 JM Chased 07/03/18 JM Chased 14/03/18 JM Reply received- ""I did receive this request.  I do have it marked as approved. We possibly received the email request from content online?"". Asked to confirm price 15/03/18 JM Price confirmation received: with the 25% discount will be $1462,50. Converted to GBP =£1039.63. 21/03/18 JM This has still not appeared on IEEE statements. Emailed Krista Thom at IEEE to investigate. Corrected price using correct exchange rate. (MH 21/5/18). IEEE confirmed that this has not yet been added to our prepay because there was not enough money in the prepay. Asked IEEE to forward us an invoice. I set this line back from 'paid' to 'confirmed accepted' for this reason. When we get an invoice, it needs to be paid in the normal way. MH 20/5/18  Appeared on Aug 2018 prepay report - asked IEEE to invoice us (MH 25/9/2018). Additional charges of US$480 still to pay (original request was for APC plus page charges). IEEE chased Victoria about this and I asked Victoria to forward the invoice to us. Please put the additional charges against the current UKRI grant MH 05/06/2019.  Invoice 1-13603562379, 05/06/2019 for $400.",375039737,"Jan 3, 2018 15:25",Computer Science,Journal Article (peer reviewed),IEEE Transactions on Computational Intelligence and AI in Games (T-CIAIG),Institute of Electrical and Electronic Engineering (IEEE),EPSRC,EP/K039857/1,EPSRC,EP/M023265/1,,,LSCITS program at the University of York,Accepted for publication,2475-1510,100% RCUK,,,US Dollars (1950 open access + 400 page charges) = 2350,,,,,,,1816.14,389.11,,,,,,,,,,,,,,,,,,,,,,,,,,,,CC BY
YOAF,Prof Jeremy Everard,High-Q Tuneable 10-GHz Bragg Resonator for Oscillator Applications,10.1109/TUFFC.2017.2782567,IEEE Transactions on Ultrasonics Ferroelectrics and Frequency Control,11/12/2017,OA fund,Paid,Appeared on Aug 2018 prepay report - asked IEEE to invoice us (MH 25/9/2018),375555465,"Jan 5, 2018 16:38",Electronic Engineering,Journal Article (peer reviewed),IEEE Transactions on Ultrasonics Ferroelectrics and Frequency Control,Institute of Electrical and Electronic Engineering (IEEE),EPSRC,EP/K040820/1,,,,,"A student was part funded by a company, Selex Ltd, now Leonardo",Accepted for publication,0885-3010,100% RCUK,,,$1950 open access fee (and $525 over lenght fee),,,,,,,1818.98,,,,,,,,,,,,,,,,,,,,,,,,,,,,29389659,CC BY
YOAF,Cheti Nicoletti,The intergenerational transmission of liberal professions,10.1016/j.labeco.2017.12.003,Labour economics,13/12/2017,OA fund,Reported to funder,"Added manually by MH, following email from Cheti. Paper has just been published, but Thom agreed we could still use funds to make it OA. I asked Cheti to ask Elsevier to invoice us.",,08/01/2018,Economics and Related Studies,Journal Article (peer reviewed),Labour economics,Elsevier,ESRC,ES/L009153/1,,,,,,,,100% RCUK,,,,,,,,,1724.03,,,,,,,,,,,,,,,,,,,,,,,,,,,,,,CC BY
YOAF,Robin Perutz,Competing pathways in the photochemistry of Ru(H)2(CO)(PPh3)3,10.1021/acs.organomet.7b00802,Organometallics,17/01/2018,OA fund,Reported to funder,,376234760,"Jan 9, 2018 10:26",Chemistry,Journal Article (peer reviewed),Organometallics,American Chemical Society (ACS),EPSRC,EP/K022792/1 and EP/D058031/1,,,,,,Accepted for publication,1520-6041,100% RCUK,,,US$2000,,,,,,1751.29,,,,,,,,,,,,,,,,,,,,,,,,,,,,,,CC BY
YOAF,Maggie Smith,Streptomyces coelicolor strains lacking polyprenol phosphate mannose synthase and protein O-mannosyl transferase are hyper-susceptible to multiple antibiotics,10.1099/mic.0.000605,Microbiology,01/02/2018,OA fund,Reported to funder,Requested invoice from Copyright clearance centre. 13/2/18 MM //Reply 16/02/18: new invoice will be sent to Maggie Smith within 24 hours. 19/02/18 EH Received invoice 20/02/18 and a duplicate 22/02/18,376237410,"Jan 9, 2018 10:49",Biology,Journal Article (peer reviewed),Microbiology,Microbiology Society,BBSRC,BB/J016691/1,BBSRC,BBS/B/05990,,,,Accepted for publication,1465-2080,100% RCUK,,,"List price is £2100, but I think I should get a discount because I am a member of the society.",,,,,,1785,357,,,,,,,,,,,,,,,,,,,,,,,,,,,,29458553,CC BY
YOAF,Damian Murphy,Application of Machine Learning for the Spatial Analysis of Binaural Room Impulse Responses,10.3390/app8010105,Applied Sciences,12/01/2018,OA fund,Reported to funder,Initial title of contribution was entered as 'Full Paper in Special Issue' if searching for previous email correspondence. MM. title details updated as altered slightly on invoice. MM. 10% MDPI discount applied.,376275008,"Jan 9, 2018 14:57",Electronic Engineering,Journal Article (peer reviewed),Applied Sciences,MDPI,EPSRC,EP/M023265/1,,,,,,Accepted for publication,2076-3417,100% RCUK,,,EUR 920.89,,,,,,991.54,,,,,,,,,,,,,,,,,,,,,,,,,,,,,,CC BY
YOAF,Sean Sweeney,Regulation of neuronal development and function by ROS,10.1002/1873-3468.12972,FEBS Letters,11/01/2018,Prepay,Reported to funder,,,43110,Biology,Journal Article (peer reviewed),FEBS Letters,Wiley,BBSRC,"BB/I012273/1, BB/IO1179X/1, BB/M002322/1, BB/M002934/1",,,,,,Accepted for publication,1873-3468,100% RCUK,Wiley prepay,,,,,,,,1687.5,,,,,,,,,,,,,,,,,,,,,,,,,,,,,,CC BY
YOAF,Professor Neil Bruce,Defining functional diversity for lignocellulose degradation in a composting microbial community using multi-omics studies,10.1186/s13068-018-1164-2,Biotechnology for Biofuels,18/06/2018,OA fund,Paid,We will pay this by invoice. Ordered an invoice 6/6/18. NB there is no discount - I queried this and was told that it was probably because the paper was accepted before the start of our Supporter Membership. Order number 0007446392.. MH 6/6/18 Invoice arrived 07/06/18,376552297,"Jan 10, 2018 15:46",Biology,Journal Article (peer reviewed),Biotechnology for Biofuels,BioMed Central (BMC),BBSRC,BB/1018492/1,BBSRC,BB/K020358/1,BBSRC,BB/P027717/1,,Submitted for publication,1754-6834,100% RCUK,,,"GBP 1,565.00",,,,,,,1938,,,,,,,,,,,,,,,,,,,,,,,,,,,,,CC BY
YOAF,Charlotte Murphy,Distant from input: Evidence of regions within the default mode network supporting perceptually-decoupled and conceptually-guided cognition,10.1016/j.neuroimage.2018.01.017,NeuroImage,01/05/2018,OA fund,Reported to funder,,377034631,"Jan 12, 2018 11:48",Psychology,Journal Article (peer reviewed),NeuroImage,Elsevier,BBSRC,BB/J006963/1,,,,,,Accepted for publication,1053-8119,100% RCUK,,,"EUR 2,651.16 (excl. tax).",,,,,,2391.88,471.41,,,,,,,,,,,,,,,,,,,,,,,,,,,,29339310,CC BY
YOAF,LI LIAO,Underwater Localization Based on Grid Computation and its Application to Transmit Beamforming in Multiuser UWA Communications,10.1109/ACCESS.2018.2793962,IEEE Access,18/01/2018,OA fund,Paid,"Appeared on Aug 2018 prepay report - asked IEEE to invoice us (MH 25/9/2018) // libr539 21/11/18, no reply. Chased twice 12/02/19; still not on PMC/EPMC. EH",377038621,"Jan 12, 2018 12:22",Electronic Engineering,Journal Article (peer reviewed),IEEE Access,Institute of Electrical and Electronic Engineering (IEEE),EPSRC,EP/P017975/1,,,,,,Accepted for publication,2169-3536,100% RCUK,,,"US$2,100.00",,,,,,,1634.9,,,,,,,,,,,,,,,,,,,,,,,,,,,,,CC BY
YOAF,Simon Baker,Differentiation-associated urothelial cytochrome P450 oxidoreductase predicates the xenobiotic-metabolising activity of “luminal” muscle-invasive bladder cancers.,10.1002/mc.22784,Molecular Carcinogenesis,11/01/2018,Prepay,Reported to funder,ON PMC 08/06/18 JM,,43116,Biology,Journal Article (peer reviewed),Molecular Carcinogenesis,Wiley,Cancer Research UK,C313/A14329,Wellcome Trust,"092430/Z/10/Z, 101126/B/13/Z, 101126/Z/13/Z, 105624 (C2D2))",NERC,NE/L006782/1,,Accepted for publication,,50-50 split,Wiley prepay,,2160,,,,,,1080,,,,,,,,,,,,,,,1080,,,,,,,,,,,,,PMC5900743,29323757,CC BY
YOAF,Professor Atsufumi Hirohata,Magneto-optical detection of spin accumulation under the influence of mechanical rotation,10.1038/s41598-018-20269-5,Scientific Reports,31/01/2018,OA fund,Reported to funder,,377932135,"Jan 17, 2018 00:16",Electronic Engineering,Journal Article (peer reviewed),Scientific Reports,Springer Nature,EPSRC,EP/M02458X/1,,,,,,Accepted for publication,2045-2322,100% RCUK,,,1110 GBP plus VAT,,,,,,1332,,,,,,,,,,,,,,,,,,,,,,,,,,,,,,CC BY
