YOAF,Christopher Wakefield,Digital Public Archaeology at Must Farm: A Critical Assessment of Social Media Use for Archaeological Engagement,10.11141/ia.55.9,Internet Archaeology,05/10/2020,OA fund,Paid,Emailed Research Student Administration Team to provide AHRC grant code. MR 26/06/2020 Grant code received - AH/R012733/1. MR 19/06/2020 Added to Sept journal file to pay Dept of Archaeology 1/10 JPC,628608639,"Jun 25, 2020 14:54:41",Archaeology,Journal article (Peer-reviewed original research article),Internet Archaeology,Internet Archaeology,AHRC,"WRoCAH CDA Funded Student, Ref No. 204040223",AH/R012733/1,,,,,Accepted for publication,1363-5387,100% RCUK,,,"£2,034.49",,,,,,,,,"2,034.49",,,,,,,,,,,,,,,,,,,,,,,,,PMC7431007,,CC BY
YOAF,Gavin Thomas,The molecular basis of thioalcohol production in human body odour,10.1038/s41598-020-68860-z,Scientific Reports,27/07/2020,OA fund,Paid,,628972846,"Jun 26, 2020 12:43:51",Biology,Journal article (Peer-reviewed original research article),Scientific Reports,Springer Nature,BBSRC,BB/N006615/1,,,,,,Accepted for publication,2045-2322,100% RCUK,,,"£1,390",,,,,,,,,1668,,,,,,,,,,,,,,,,,,,,,,,,,,,CC BY
YOAF,Pedro Rafael Saramago Goncalves,Bayesian econometric modelling of observational data for cost-effectiveness analysis Establishing the value of Negative Pressure Wound Therapy in the healing of open surgical wounds,,Journal of the Royal Statistical Society: Series A (Statistics in Society),,Prepay,Paid,,629803780,"Jun 29, 2020 14:17:23",Centre for Health Economics,Journal article (Peer-reviewed original research article),Journal of the Royal Statistical Society: Series A (Statistics in Society),Wiley,,,,,,,National Institute for Health Research (GrantNumber(s): RP-PG-0609-10171),Accepted for publication,,,Wiley prepay,,"₤1,500",,,,,,,,,,,,,,,,,,,,,,,,,,,,,,,,,,,,
YOAF,Hong Gao,Application of Serine Integrases for Secondary Metabolite Pathway Assembly in Streptomyces,10.1016/j.synbio.2020.05.006,Synthetic and Systems Biotechnology,18/06/2020,OA fund,Paid,"Forwarded to DR and Research and Data Outputs Specialists - paper has been published under a CC-BY-NC-ND 4.0 licence. MR 03/07/2020 Journal not on SHERPA/FACT - have checked journal on SHERPA/Romeo and publisher website, paper has also been deposited in PMC so decided paper is compliant. Email sent to author to change current licence to CC-BY and once this has changed, paper will be compliant and can be paid for. MR 10/07/2020 Author emailed to let us know paper has been updated - checked licence on publisher's website and is now CC-BY. See libr539 for more info. MR 21/07/2020 Need to set up publisher as vendor in order to pay - email sent to publisher asking for contact information. MR 27/07/2020 Information received and forwarded to JC - KeAi now set up as suppliers on Agresso. MR 31/07/2020",630194949,"Jun 30, 2020 09:05:44",Biology,Other: Journal article,Synthetic and Systems Biotechnology,Elsevier,BBSRC,BB/K003356/1,,,,,"HPLC-MS analysis was performed on equipment within the Centre of Excellence in Mass Spectrometry (University of York), funded by Science City York (Yorkshie Forward, EP/K039660/1, EP/M028127/1).",Published,2405-805X,100% RCUK,,,USD 417.61,,,,,,,,,392.47,,,,,,,,,,,,,,,,,,,,,,,,,,,CC BY
YOAF,Viktor Manahov,High-frequency trading order cancelations and market quality: Is stricter regulation the answer?,,International Journal of Finance & Economics,,Prepay,Paid,,630197441,"Jun 30, 2020 09:22:48",York Management School,Journal article (Peer-reviewed original research article),International Journal of Finance & Economics,Wiley,,,,,,,,Accepted for publication,,,Wiley prepay,,"₤1,250.25",,,,,,,,,,,,,,,,,,,,,,,,,,,,,,,,,,,,
YOAF,Henrice Altink,"Tackling child malnutrition in Jamaica, 1962-2020.",10.1057/s41599-020-00536-5,Humanities and Social Sciences Communications.,30/07/2020,OA fund,Paid,"Checking grant code as work order number was given. MR 01/07/2020 Now updated. MR 02/07/2020 Journal title not yet updated on SHERPA - previously 'Palgrave Communications'. Not in PMC/EPMC, author sent instructions from Springer on how to login and accept deposit to PMC/EPMC. Asking Springer if they can confirm to us if author has done this. There is a processing period of around 2-4 weeks before the article will appear in EuropePMC. Still not appearing MM 23/11/20",630656462,"Jul 1, 2020 10:11:21",History,Journal article (Peer-reviewed original research article),Humanities and Social Sciences Communications.,Springer Nature,Wellcome Trust,204829,,,,,This project was funded by a grant from the Centre for Future health which is a wellcome funded centre. The grant code is a0167368. in my grant letter it is mentioned that should journals require a charge then money is available from the Wellcome to pay for this.,Accepted for publication,2662-9992,100% COAF,,,£760,,,,,,,,,,,,,,,,,,,,,,,,,,948,,,,,,,,,,CC BY
YOAF,Jane Suter,The impact of moving to a 12 hour shift pattern on employee wellbeing: a qualitative study in an acute mental health setting,10.1016/j.ijnurstu.2020.103699,International Journal of Nursing Studies,09/07/2020,OA fund,Paid,,630729808,"Jul 1, 2020 13:34:18",York Management School,Journal article (Peer-reviewed original research article),International Journal of Nursing Studies,Elsevier,Wellcome Trust,Centre for Future Health 204829,,,,,,Accepted for publication,0020-7489,100% COAF,,,"£2,470.00",,,,,,,,,,,,,,,,,,,,,,,,,,"£2,964.00",,,,,,,,PMC7695681,32747148,CC BY
YOAF,Sean Sweeney,Retrovirus reactivation in CHMP2BIntron5 models of Frontotemporal Dementia,10.1093/hmg/ddaa142,Human Molecular Genetics,06/07/2020,OA fund,Paid,,631172654,"Jul 2, 2020 11:12:45",Biology,Journal article (Peer-reviewed original research article),Human Molecular Genetics,Oxford University Press (OUP),Wellcome Trust,204829,,,,,MNDA Project Grant [grant number: AD011701],Accepted for publication,1460-2083,100% COAF,,,"£2,625",,,,,,,,,,,,,,,,,,,,,,,,,,,3150,,,,,,,PMC7530534,32628265,CC BY
YOAF,Simon Walker,Cost-effectiveness of Cardiovascular Imaging for Stable Coronary Heart Disease,10.1136/heartjnl-2020-316990,Heart,14/08/2020,Prepay,Paid,Forwarded to DR and Specialists - checking to see if we can pay from BMJ prepay (COAF funded) MR 02/06/2020. Paid from BMJ OA account but should have been charged to BHF.,631257135,"Jul 2, 2020 15:16:57",Centre for Health Economics,Journal article (Peer-reviewed original research article),Heart,British Medical Journal (BMJ),British Heart Foundation,SP/12/1/29062,,,,,,Accepted for publication,,,BMJ prepay,,£2650 (excluding VAT) (£2300 + £350 image fee),,,,,,,,,,,,,,,,,,,,,,,,,,,,,,2815.2,,,,,,CC BY
YOAF,Nik Brown,"The coughing body: etiquettes, techniques, sonographies and spaces",10.1057/s41292-020-00196-3,Biosocieties,15/09/2020,OA fund,Paid,,631553079,"Jul 3, 2020 10:25:06",Sociology,Journal article (Peer-reviewed original research article),Biosocieties,Springer Nature,AHRC,AH/R002037/1,,,,,,Accepted for publication,1745-8560,100% RCUK,,,"£1,870.00",,,,,,,,,2244,,,,,,,,,,,,,,,,,,,,,,,,,,,CC BY
YOAF,Hilary Graham,The representation of future generations in newspaper coverage of climate change: a study of the UK press,,Children & Society,,Prepay,Paid,,631571519,"Jul 3, 2020 12:21:38",Health Sciences,Journal article (Peer-reviewed original research article),Children & Society,Wiley,ESRC,ES/L003015/1,,,,,C & JB Morrell Trust Priming Fund (University of York),Accepted for publication,,,Wiley prepay,,"₤1,387.50",,,,,,,,,,,,,,,,,,,,,,,,,,,,,,,,,,,,
YOAF,Sofia Vasilopoulou,Brexit and the 2019 EP election in the UK,,JCMS: Journal of Common Market Studies,,Prepay,Paid,,631572929,"Jul 3, 2020 12:28:46",Politics,Journal article (Peer-reviewed original research article),JCMS: Journal of Common Market Studies,Wiley,,,,,,,,Accepted for publication,,,Wiley prepay,,"₤1,599.75",,,,,,,,,,,,,,,,,,,,,,,,,,,,,,,,,,,,
YOAF,Christopher RIdgers,The inadequacy of a magnetohydrodynamic approach to the Biermann Battery,10.1098/rsta.2020.0017,Philosophical Transactions of the Royal Society A,07/12/2020,OA fund,Paid,Christopher emailed to let us know paper has now been accepted for publication. MR 15/09/2020,632816229,"Jul 7, 2020 17:21:27",Physics,Journal article (Peer-reviewed original research article),Philosophical Transactions of the Royal Society A,The Royal Society,EPSRC,EP/M011372/1,,,,,,Submitted for publication,1471-2962,100% RCUK,,,"£1,700",,,,,,,,,1530,,,,,,,,,,,,,,,,,,,,,,,,,,,CC BY
YOAF,Alastair Lewis,An increasing role for solvent emissions and implications for future measurements of Volatile Organic Compounds,10.1098/rsta.2019.0328,Philosophical Transactions A,28/09/2020,OA fund,Paid,,633231025,"Jul 8, 2020 16:22:41",Chemistry,Journal article (Peer-reviewed original research article),Philosophical Transactions A,The Royal Society,NERC - Natural Environment Research Council,NE/R011532/1,NERC - Natural Environment Research Council,NE/T001917/1,NERC - Natural Environment Research Council,NE/P016502/1,,Accepted for publication,1471-2962,100% RCUK,,,"£1,700",,,,,,,,,"1,530.00",,,,,,,,,,,,,,,,,,,,,,,,,,,CC BY
YOAF,Daphne Ezer,PAFway: pairwise associations between functional annotations in biological networks and pathways,10.1093/bioinformatics/btaa639,Bioinformatics,17/07/2020,OA fund,Paid,"Waiting for invoice, Daphne is having trouble receiving invoice from the publisher's finance team. I asked Daphne to keep us updated and if still can't get this resolved to let us know and we will contact the publisher. MR 30/07/2020",633522563,"Jul 9, 2020 09:51:01",Biology,Journal article (Peer-reviewed original research article),Bioinformatics,Oxford University Press (OUP),EPSRC,EP/S001360/2,,,,,Alan Turing Institute,Accepted for publication,1460-2059,100% RCUK,,,"£2,050",,,,,,,,,2460,,,,,,,,,,,,,,,,,,,,,,,,,,,CC BY
YOAF,Marjan van der Woude,Acetylation of surface carbohydrates in bacterial pathogens requires coordinated action of a two-domain membrane-bound acyltransferase,10.1128/mBio.01364-20,mBio,25/08/2020,OA fund,Paid,"Author forwarded email from ASM stating: 'There are no publication fees associated with your manuscript.' Holding email has been sent to author and I have contacted ASM on behalf asking to clarify if a publication charge will be assigned to this manuscript at the time of publication. MR 21/07/2020 Publisher replied stating: ""Yes, you can make payment. Please find below link for generating invoice and payment."" I've forwarded this to Marjan to follow instructions. MR 24/07/2020 Marjan emailed with information from publisher, see libr539, still unsure if needs to be paid. Checked with Derryn and DR and MH will look into this next week. MR 24/07/2020 Marjan forwarded information from the publisher that this was a server error and payment is needed. Advised Marjan to select the 'Purchase Order' option as the payment method in order to generate an invoice - invoice details sent. MR 27/07/2020 Invoice forwarded and now processed. MR 27/07/2020 Additional costs - Supplemental Material. Payment delayed due to misleading invoice. New request for PO submitted 21/8 JPC. Agresso report 202001: 8.4% of original total invoice charge is used to calculate 'Additional Charges'. MM",634091513,"Jul 10, 2020 17:40:41",Hull York Medical School,Journal article (Peer-reviewed original research article),mBio,American Society for Microbiology (ASM),BBSRC,White Rose Doctoral Training Programme (BB/M011151/1): Mechanistic Biology 523 and its Strategic Application.,,,,,,Accepted for publication,2150-7511,100% RCUK,,,US Dollars $2730,,,,,,,,,2605.47,,,,,,,,,,,,,,,,,,,,,,,,,,,CC BY
YOAF,Peter Ivatt,Improving the prediction of an atmospheric chemistry transport model using gradient boosted gradient-boosted regression trees,10.5194/acp-20-8063-2020,Atmospheric Chemistry and Physics,13/07/2020,OA fund,Paid,,634732874,"Jul 13, 2020 08:56:55",Chemistry,Journal article (Peer-reviewed original research article),Atmospheric Chemistry and Physics,Copernicus,NERC - Natural Environment Research Council,NE/L01291X/1,,,,,,Accepted for publication,1680-7324,100% RCUK,,,1540.00 Euros,,,,,,,,,1721.87,,,,,,,,,,,,,,,,,,,,,,,,,,,CC BY
YOAF,Rosie Chance,Surface Inorganic Iodine Speciation in the Indian and Southern Oceans from 12oN to 70oS,10.3389/fmars.2020.00621,Frontiers in Marine Science,31/08/2020,OA fund,Paid,,634782156,"Jul 13, 2020 12:42:21",Chemistry,Journal article (Peer-reviewed original research article),Frontiers in Marine Science,Frontiers,NERC - Natural Environment Research Council,NE/N009983/1,NERC - Natural Environment Research Council,NE/N01054X/1,,,,Accepted for publication,2296-7745,100% RCUK,,,USD 2950,,,,,,,,,"2,804.86",,,,,,,,,,,,,,,,,,,,,,,,,,,CC BY
YOAF,Freya Squires,Measurements of traffic dominated pollutant emissions in a Chinese megacity,10.5194/acp-20-8737-2020,Atmospheric Chemistry and Physics,23/07/2020,OA fund,Paid,Invoice ACP-PUC-2021-501 for a corrigendum on the published paper. Approved and sent for payment (UKRI 2021/22 budget) MM 22/06/2021.,634850819,"Jul 13, 2020 15:36:02",Chemistry,Journal article (Peer-reviewed original research article),Atmospheric Chemistry and Physics,Copernicus,NERC - Natural Environment Research Council,NE/N006917/1,,,,,,Accepted for publication,1680-7324,100% RCUK,,,"£1,500",,,,,,,,,2140.67,53.99,,,,,,,,,,,,,,,,,,,,,,,,,,CC BY
YOAF,Sakshi Mohan,Allocating resources to support universal health coverage: policy processes and implementation in Malawi,10.1136/bmjgh-2020-002766,BMJ Global Health,25/08/2020,OA fund,Paid,Author confirmed request id 635396793 and 635849814 papers are independent but complementary and have both been accepted for publication in BMJ Global Health. MM 16/7/2020 Journalled against UKRI 4/11 JPC,635396793,"Jul 14, 2020 19:01:32",Centre for Health Economics,Journal article (Peer-reviewed original research article),BMJ Global Health,British Medical Journal (BMJ),MRC,MR/P028004/1,,,,,,Accepted for publication,2059-7908,100% RCUK,,,GBP 1500,,,,,,,,,3060,,,,,,,,,,,,,,,,,,,,,,,,,PMC7449351,32843526,CC BY
YOAF,Finn McGuire,Allocating resources to support universal health coverage: development of a geographical funding formula in Malawi,10.1136/bmjgh-2020-002763,BMJ Global Health,15/09/2020,OA fund,Paid,Author confirmed request id 635396793 and 635849814 papers are independent but complementary and have both been accepted for publication in BMJ Global Health. MM 16/7/2020. Journalled against UKRI 4/11 JPC,635849814,"Jul 15, 2020 10:34:45",Centre for Health Economics,Journal article (Peer-reviewed review article not commissioned by the journal),BMJ Global Health,British Medical Journal (BMJ),MRC,Thanzi la Onse grant number MR/P028004/1,,,,,"The research is part of the Thanzi La Onse project which is funded through UK Research and Innovation as part of the Global Challenges Research Fund.

Thanzi la Onse grant number MR/P028004/1.",Accepted for publication,2059-7908,100% RCUK,,,"£3,000",,,,,,,,,3060,,,,,,,,,,,,,,,,,,,,,,,,,PMC7493092,32938613,CC BY
YOAF,Terry J. Dillon,Rate coefficients for reactions of OH with aromatic and aliphatic volatile organic compounds determined by the Multivariate Relative Rate Technique,10.5194/acp-20-9725-2020,Atmospheric Chemistry and Physics,19/08/2020,OA fund,Paid,"Author PhD student Jacob Shaw (now left), request submitted by co-author & York supervisor T. Dillon.",635913816,"Jul 15, 2020 13:35:33",Chemistry,Journal article (Peer-reviewed original research article),Atmospheric Chemistry and Physics,Copernicus,NERC - Natural Environment Research Council,NE/M013448/1,NERC - Natural Environment Research Council,NE/J008990/1,NERC - Natural Environment Research Council,NE/J008532/1,,Accepted for publication,1680-7324,100% RCUK,,,Euros 2000 (Euro 93 per journal page)*,,,,,,,,,1249.55,,,,,,,,,,,,,,,,,,,,,,,,,,,CC BY
YOAF,Laurence Wilson,Haloarchaea Swim Slowly for Optimal Chemotactic Efficiency in Low Nutrient Environments,10.1038/s41467-020-18253-7,Nature Communications,08/09/2020,OA fund,Paid,,636138894,"Jul 15, 2020 22:57:15",Physics,Journal article (Peer-reviewed original research article),Nature Communications,Springer Nature,EPSRC,EP/N014731/1,,,,,,Accepted for publication,2041-1723,100% RCUK,,,"£3,790 (+VAT, if applicable)",,,,,,,,,4548,,,,,,,,,,,,,,,,,,,,,,,,,,,CC BY
YOAF,Alexander Harrison,Is improvement in depression in patients attending cardiac rehabilitation with new onset depressive symptoms determined by patient characteristics?,10.1136/openhrt-2020-001264,Open Heart,26/08/2020,Prepay,Paid,"Passed to DR as COAF funded. MM 16/07/2020 BMJ stock email sent, checked with DR and we will need to claim the amount back from British Heart Foundation when we get the BMJ report. Please let DR know if we receive further correspondence about the article. MR 29/07/2020",636260517,"Jul 16, 2020 08:59:03",Health Sciences,Journal article (Peer-reviewed original research article),Open Heart,British Medical Journal (BMJ),British Heart Foundation,040/PSS/17/18/NACR,,,,,,Accepted for publication,2053-3624,100% COAF,BMJ prepay,,"£1,000 GBP",,,,,,,,,,,,,,,,,,,,,,,,,,,,,,2386.8,,,,,,CC BY
YOAF,Pratibha Gai,Atom-by-atom analysis of sintering dynamics and stability of Pt nanoparticles in chemical reactions,10.1098/rsta.2019.0597,Philosophical Transactions of the Royal Society A.,26/10/2020,OA fund,Paid,Request title originally came through as: Original research article on atom analysis in chemical reactions,636264726,"Jul 16, 2020 09:29:08",Chemistry,"Other:   original peer reviewed research article,",Philosophical Transactions of the Royal Society A.,The Royal Society,EPSRC,EP/J0118058/1,,,,,,Accepted for publication,1471-2962,100% RCUK,,,£1700  (GBP),,,,,,,,,1530,,,,,,,,,,,,,,,,,,,,,,,,,,,CC BY
YOAF,Prof. Kamran Siddiqi,Smoking prevalence among tuberculosis patients: A cross-sectional study in Bangladesh and Pakistan,10.18332/tid/125452,Tobacco Induced Diseases,16/08/2020,OA fund,Paid,"Not in SherpaFact but all articles published under CC BY. Pub site did not mention deposit to PMC so asked author to do this (allowed for MRC papers according to policy doc). MM. VAT incorrectly coded as a book on Agresso, journal request submitted TB 26/05/2021.",636384543,"Jul 16, 2020 15:39:23",Health Sciences,Conference proceedings paper  (Peer-reviewed review paper),Tobacco Induced Diseases,E.U. European Publishing,MRC,: MC_PC_MR/T037806/1,,,,,,Accepted for publication,1617-9625,100% RCUK,,,"1,950.00 EUR",,,,,,,,,2166.22,,,,,,,,,,,,,,,,,,,,,,,,,PMC7485439,32934616,CC BY
YOAF,Nils Morozs,Channel Modeling for Underwater Acoustic Network Simulation,10.1109/ACCESS.2020.3011620,IEEE Access,23/07/2020,OA fund,Paid,"VAT incorrectly coded as Books on Agrssso, journal request submitted 26/05/2021.",638304726,"Jul 22, 2020 08:42:26",Electronic Engineering,Journal article (Peer-reviewed original research article),IEEE Access,Institute of Electrical and Electronic Engineering (IEEE),EPSRC,EP/P017975/1,EPSRC - Engineering & Physical Sciences Research Council,EP/R003297/1,,,,Accepted for publication,2169-3536,100% RCUK,,,1750 USD,,,,,,,,,1562.56,,,,,,,,,,,,,,,,,,,,,,,,,,,CC BY
YOAF,Reidun Twarock,Surface stresses in complex viral capsids and non-quasiequivalent viral architectures,10.1098/rsif.2020.0455,Journal of the Royal Society Interface,05/08/2020,OA fund,Paid,,638737451,"Jul 23, 2020 11:05:11",Mathematics,Journal article (Peer-reviewed original research article),Journal of the Royal Society Interface,The Royal Society,EPSRC,R2005601  /   EP/R023204/1,WT - Wellcome Trust,R1730003 / 110146,,,Royal Society Wolfson Fellowship (RSWF\R1\180009),Accepted for publication,1742-5662,50-50 split,Royal Society discount,,"£1,275",,,,,,,,,765,,,,,,,,,,,,,,,,,765,,,,,,,,PMC7482553,32752992,CC BY
YOAF,Kirsty High,A review of analytical methods for assessing preservation in waterlogged archaeological wood and their application in practice,10.1186/s40494-020-00422-y,Heritage Science,14/08/2020,OA fund,Paid,Springer fully OA journal. MM. Kirsty emailed stating there is also a £50 admin fee to pay updating total to £1110 - checked with Derryn and as this journal doesn't fall under our prepay deal we do have to pay extra. Email sent to Kirsty. MR 27/07/2020,638778999,"Jul 23, 2020 13:23:06",Chemistry,Journal article (Peer-reviewed review article not commissioned by the journal),Heritage Science,Springer Nature,NERC - Natural Environment Research Council,NE/P005799/1,,,,,,Accepted for publication,2050-7445,100% RCUK,,,1060 GBP,,,,,,,,,1332,,,,,,,,,,,,,,,,,,,,,,,,,,,CC BY
YOAF,Prof Gideon Davies,Substrate engagement and catalytic mechanisms of N-acetylglucosaminyltransferase V,10.1021/acscatal.0c02222,ACS Catalysis,16/07/2020,OA fund,Paid,"YSBL Admin Office chased for response. Re-sent email we sent 28/07/20. MM 10/08/20 YSBL replied stating that the author is currently listed as Liang Wu who used to work for Chemistry until very recently, but now works for the Rosalind Franklin Institute Currently. Invoice includes other author names including Gideon Davies, checked with DR and okay to process invoice. MR 12/08/2020. RightLink chasing payment, sent reply 10/09/20 MM",640066654,"Jul 27, 2020 14:58:28",Chemistry,Journal article (Peer-reviewed original research article),ACS Catalysis,American Chemical Society (ACS),BBSRC,BB/N008332/1,,,,,,Accepted for publication,2155-5435,100% RCUK,,,$5000 USD,,,,,,,,,4752.65,,,,,,,,,,,,,,,,,,,,,,,,,,,CC BY
YOAF,Roy Chantrell,"Exploiting unique alignment of cobalt ferrite nanoparticles, mild hyperthermia, and controlled intrinsic cobalt toxicity for cancer therapy",10.1002/adma.202003712,Advanced Materials,01/10/2020,OA fund,Paid,"Confirmed accepted. Sent Wiley stock email. MM 10/8/20. Roy not corresponding author, passed to DR. 10/08/20 MM. As UKRI funded TB approved to pay via regular invoice and will not go through Wiley R&P deal. Invoicing details sent to author. 14/8/20 MM",645019141,"Aug 8, 2020 12:57:01",Physics,Journal article (Peer-reviewed original research article),Advanced Materials,Wiley,EPSRC,EP/K031589/1,,,,,,Accepted for publication,1521-4095,100% RCUK,,,"£3,750",,,,,,,,,4500,,,,,,,,,,,,,,,,,,,,,,,,,,,CC BY
YOAF,Sean Sweeney,Neuroprotective Activity of Ursodeoxycholic Acid in CHMP2BIntron5 Models of Frontotemporal Dementia,10.1016/j.nbd.2020.105047,Neurobiology of Disease,Oct-20,OA fund,Paid,,645473857,"Aug 10, 2020 11:22:57",Biology,Journal article (Peer-reviewed original research article),Neurobiology of Disease,Elsevier,Wellcome Trust,204829,,,,,"The Alzheimer’s Society, Grant numbers AS-PG-2013- 005, AS-JF-16b-004
Alzheimer's Research UK [Grant number ARUK-PPG2017A-7]
Motor Neurone Disease Association, [Grant number Sweeney/Oct15/884-792]",Accepted for publication,0969-9961,100% COAF,,,$2500,,,,,,,,,,,,,,,,,,,,,,,,,,2352,,,,,,,,PMC7491204,32801000,CC BY
YOAF,Sean Sweeney,JNK signalling regulates antioxidant responses in neurons,10.1016/j.redox.2020.101712,Redox Biology,Sep-20,OA fund,Paid,To be moved to Wellcome 20/21,645475389,"Aug 10, 2020 11:29:35",Biology,Journal article (Peer-reviewed original research article),Redox Biology,Elsevier,BBSRC,"BB/I012273/1, BB/M002322/1",WT - Wellcome Trust,204829,,,,Accepted for publication,2213-2317,50-50 split,,,$3450,,,,,,,,,1626,,,,,,,,,,,,,,,,,,1626,,,,,,,PMC7502373,32949970,CC BY
YOAF,Aidan Horner,Forgetting across a hierarchy of episodic representations,10.1016/j.conb.2020.08.004,Current Opinion in Neurobiology,01/09/2020,OA fund,Paid,"Checking article not commissioned by the publisher, if review paper. Author confirmed ""wasn't directly commissioned by the publisher"". MM 10/8/20",645479261,"Aug 10, 2020 11:42:57",Psychology,Journal article (Peer-reviewed review article not commissioned by the journal),Current Opinion in Neurobiology,Elsevier,ESRC,ES/R007454/1,,,,,,Accepted for publication,0959-4388,100% RCUK,,,"USD 4220, excluding taxes",,,,,,,,,3972,,,,,,,,,,,,,,,,,,,,,,,,,,,CC BY
YOAF,Ahmad Salman,Predictors of Quitting Smoking in Cardiac Rehabilitation,,Journal of Clinical Medicine,,OA fund,Matched by Library,"Passed to DR as COAF grant run out. DR has confirmed that the invoice is okay to process. Once published, we will need to claim back from British Heart Foundation. MR 14/09/2020",645509849,"Aug 10, 2020 13:09:22",Health Sciences,Journal article (Peer-reviewed original research article),Journal of Clinical Medicine,MDPI,British Heart Foundation,040/PSS/17/18/NACR,,,,,,Accepted for publication,2077-0383,100% COAF,,,1650 CHF,,,,,,,,,,,,,,,,,,,,,,,,,,,,,,1435.91,,,,,,
YOAF,Gonzalo Blanco,Proteomic resolution of IGFN1 complexes reveals a functional interaction with the actin nucleating protein COBL,10.1016/j.yexcr.2020.112179,Experimental Cell Research,05/08/2020,OA fund,Paid,Gonzalo originally stated in the YOAF request that the journal was 'Journal of Experimental and Cell Research' however I couldn't find this on SHERPA but found 'Experimental Cell Research'. Email sent to Gonzalo who has confirmed that 'Experimental Cell Research' is correct - now updated. MR 14/08/2020,645911881,"Aug 11, 2020 09:13:13",Biology,Journal article (Peer-reviewed original research article),Experimental Cell Research,Elsevier,BBSRC,BB/M011151/1,EPSRC - Engineering & Physical Sciences Research Council,EP/K039660/1; EP/M028127/1,,,,Accepted for publication,0014-4827,100% RCUK,,,2610 USD,,,,,,,,,"2,256.00",,,,,,,,,,,,,,,,,,,,,,,,,,,CC BY
