"The genetic architecture of adaptation: convergence and pleiotropy in Heliconius wing pattern evolution",2019,"Heredity","10.1038/s41437-018-0180-0","https://www.scopus.com/inward/record.uri?eid=2-s2.0-85060555093&doi=10.1038%2fs41437-018-0180-0&partnerID=40&md5=a88331a68f036f7d0443e60daf34a56e","Harvard University; Genetics Society; Natural Environment Research Council; National Eye Research Centre","Morris, J.; Department of Biology, United Kingdom; email: jake89.morris@gmail.com","English",Article,"All Open Access, Hybrid Gold, Green",Scopus
"Exploring the differential impact of work passion on life satisfaction and job performance via the work–family interface",2019,"Personnel Review","10.1108/PR-02-2017-0033","https://www.scopus.com/inward/record.uri?eid=2-s2.0-85067857003&doi=10.1108%2fPR-02-2017-0033&partnerID=40&md5=a4be874fedef93cc9d6e10645bdd2df6",,"Singh, P.; School of Human Resource Management, United Kingdom; email: singhp@yorku.ca","English",Article,"",Scopus
"How do federal regulations affect consumer prices? An analysis of the regressive effects of regulation",2019,"Public Choice","10.1007/s11127-017-0479-z","https://www.scopus.com/inward/record.uri?eid=2-s2.0-85030862720&doi=10.1007%2fs11127-017-0479-z&partnerID=40&md5=346aee06e314d8eed8a973c78d54fdaa","George Mason University","Chambers, D.; Department of Economics and Finance, 1101 Camden Ave, United States; email: DLChambers@salisbury.edu","English",Article,"All Open Access, Green",Scopus
"Improved Value for the Gamow-Teller Strength of the Sn 100 Beta Decay",2019,"Physical Review Letters","10.1103/PhysRevLett.122.222502","https://www.scopus.com/inward/record.uri?eid=2-s2.0-85066950864&doi=10.1103%2fPhysRevLett.122.222502&partnerID=40&md5=3b4c083bbefb593b51db0baa965d619c","Natural Sciences and Engineering Research Council of Canada; Deutsche Forschungsgemeinschaft; Bundesministerium für Bildung und Forschung; Ministerio de Economía y Competitividad; National Research Foundation of Korea; Ministry of Education, Science and Technology; RIKEN; Hanns-Seidel-Stiftung","Faestermann, T.; Physik Department E12, Germany; email: thomas.faestermann@tum.de","English",Article,"All Open Access, Green",Scopus
"The trade-off between fix rate and tracking duration on estimates of home range size and habitat selection for small vertebrates",2019,"PLoS ONE","10.1371/journal.pone.0219357","https://www.scopus.com/inward/record.uri?eid=2-s2.0-85069579806&doi=10.1371%2fjournal.pone.0219357&partnerID=40&md5=84c856fba5c0f308a8718d946500b0ec",,,"English",Article,"All Open Access, Gold, Green",Scopus
"Impediments to achieving integrated marine management across borders: The case of the EU Marine Strategy Framework Directive",2019,"Marine Policy","10.1016/j.marpol.2019.02.033","https://www.scopus.com/inward/record.uri?eid=2-s2.0-85062232232&doi=10.1016%2fj.marpol.2019.02.033&partnerID=40&md5=058a43e8ca16b0abab67eac90bab84a1","Centro de Estudos Ambientais e Marinhos, Universidade de Aveiro; Federación Española de Enfermedades Raras; Ministério da Ciência, Tecnologia e Ensino Superior; Universidade de Vigo; Fundació Catalana de Trasplantament","Cavallo, M.; Department of Applied Economics, Spain; email: cavallom16@gmail.com","English",Article,"All Open Access, Green",Scopus
"Carbon resource richness shapes bacterial competitive interactions by alleviating growth-antibiosis trade-off",2019,"Functional Ecology","10.1111/1365-2435.13292","https://www.scopus.com/inward/record.uri?eid=2-s2.0-85061385097&doi=10.1111%2f1365-2435.13292&partnerID=40&md5=b5b511090090e78ed624db94ee454e87","New York University Shanghai; Centre for Chronic Diseases and Disorders; Wellcome Trust; Jiangsu Province Postdoctoral Science Foundation; National Natural Science Foundation of China; Universiteit Utrecht; Nanjing Agricultural University; China Academy of Space Technology; Ministry of Agriculture and Rural Affairs of the People's Republic of China; National Basic Research Program of China (973 Program); Qinglan Project of Jiangsu Province of China","Wei, Z.; Jiangsu Provincial Key Lab for Organic Solid Waste Utilization, China; email: weizhong@njau.edu.cn","English",Article,"All Open Access, Bronze, Green",Scopus
"Immobilization of Myceliophthora thermophila laccase on poly(glycidyl methacrylate) microspheres enhances the degradation of azinphos-methyl",2019,"Journal of Applied Polymer Science","10.1002/app.47417","https://www.scopus.com/inward/record.uri?eid=2-s2.0-85059027175&doi=10.1002%2fapp.47417&partnerID=40&md5=ead1b68928e85588c779f16a0651abfa","Austrian Science Fund; Comisión Nacional de Investigación Científica y Tecnológica","Rivas, B.L.; Department of Polymer, Casilla 160-C, Edmundo Larenas 129, Chile; email: brivas@udec.cl","English",Article,"",Scopus
"A new method for enamel amino acid racemization dating: A closed system approach",2019,"Quaternary Geochronology","10.1016/j.quageo.2018.11.005","https://www.scopus.com/inward/record.uri?eid=2-s2.0-85057338454&doi=10.1016%2fj.quageo.2018.11.005&partnerID=40&md5=ed5e0b8e9611f47c1e03e216c81eb4cb","Natural Environment Research Council; Leverhulme Trust; National Eye Research Centre; Natural History Museum","Dickinson, M.R.; Department of Chemistry, United Kingdom; email: md548@york.ac.uk","English",Article,"All Open Access, Green",Scopus
"Partitioning intraspecific variation in seed dispersal potential using a low-cost method for rapid estimation of samara terminal velocity",2019,"Methods in Ecology and Evolution","10.1111/2041-210X.13202","https://www.scopus.com/inward/record.uri?eid=2-s2.0-85070230759&doi=10.1111%2f2041-210X.13202&partnerID=40&md5=bfd8483a8418f5d4594cce7da85b9479","Ministry of Business, Innovation and Employment","Wyse, S.V.; Bio-Protection Research Centre, New Zealand; email: sarah.wyse@lincoln.ac.nz","English",Article,"All Open Access, Green",Scopus
"Unravelling the scientific debate on how to address wolf-dog hybridization in Europe",2019,"Frontiers in Ecology and Evolution","10.3389/fevo.2019.00175","https://www.scopus.com/inward/record.uri?eid=2-s2.0-85066777771&doi=10.3389%2ffevo.2019.00175&partnerID=40&md5=11fd494f2171ab6703fdeb6f55041f86","Ministry of Education; Natural Environment Research Council; Eesti Teadusagentuur","Donfrancesco, V.; Centre for Ecology and Conservation, United Kingdom; email: donfrancesco.valerio@gmail.com","English",Article,"All Open Access, Gold, Green",Scopus
"Diamines as interparticle linkers for silica-titania supported PdCu bimetallic nanoparticles in Chan-Lam and Suzuki cross-coupling reactions",2019,"New Journal of Chemistry","10.1039/c8nj05050c","https://www.scopus.com/inward/record.uri?eid=2-s2.0-85063210409&doi=10.1039%2fc8nj05050c&partnerID=40&md5=898a2085b7eccabd1d2c50c7d1690d20",,"Paul, S.; Department of Chemistry, India; email: paul7@rediffmail.com","English",Article,"All Open Access, Green",Scopus
"Magnetic anisotropy of the noncollinear antiferromagnet IrMn3",2019,"Physical Review B","10.1103/PhysRevB.100.220405","https://www.scopus.com/inward/record.uri?eid=2-s2.0-85076550397&doi=10.1103%2fPhysRevB.100.220405&partnerID=40&md5=0011a25d5dac8fdfa81b084c436afeef",,,"English",Article,"All Open Access, Green",Scopus
"A systematic review and network meta-analysis of bacterial and viral vaccines, administered at or near arrival at the feedlot, for control of bovine respiratory disease in beef cattle",2019,"Animal Health Research Reviews","10.1017/S1466252319000288","https://www.scopus.com/inward/record.uri?eid=2-s2.0-85079772234&doi=10.1017%2fS1466252319000288&partnerID=40&md5=b1b617999d9f075532562899fe15c0e0","Pew Charitable Trusts","O'connor, A.M.; Department of Veterinary Diagnostic and Production Animal Medicine, United States; email: oconnor@iastate.edu","English",Review,"All Open Access, Hybrid Gold",Scopus
"Testing the benefits of conservation set-asides for improved habitat connectivity in tropical agricultural landscapes",2019,"Journal of Applied Ecology","10.1111/1365-2664.13472","https://www.scopus.com/inward/record.uri?eid=2-s2.0-85070793686&doi=10.1111%2f1365-2664.13472&partnerID=40&md5=9cbfdc91b38259d3bbc7b7d290c004ec","National Aeronautics and Space Administration; Natural Environment Research Council","Scriven, S.A.; Department of Biology, United Kingdom; email: sarah.scriven@york.ac.uk","English",Article,"All Open Access, Hybrid Gold, Green",Scopus
"Discovery, activity and characterisation of an AA10 lytic polysaccharide oxygenase from the shipworm symbiont Teredinibacter turnerae",2019,"Biotechnology for Biofuels","10.1186/s13068-019-1573-x","https://www.scopus.com/inward/record.uri?eid=2-s2.0-85073155517&doi=10.1186%2fs13068-019-1573-x&partnerID=40&md5=6c2a95893e3e510af717236982a0ca0d","Biotechnology and Biological Sciences Research Council; Royal Society","Davies, G.J.; Department of Chemistry, United Kingdom; email: gideon.davies@york.ac.uk","English",Article,"All Open Access, Gold, Green",Scopus
"A machine-learning-based global sea-surface iodide distribution",2019,"Earth System Science Data","10.5194/essd-11-1239-2019","https://www.scopus.com/inward/record.uri?eid=2-s2.0-85071273536&doi=10.5194%2fessd-11-1239-2019&partnerID=40&md5=3422da60ac9c5c75cfcd66b8e0a96743","Natural Environment Research Council","Sherwen, T.; National Centre for Atmospheric Science, United Kingdom; email: tomas.sherwen@york.ac.uk","English",Article,"All Open Access, Gold, Green",Scopus
"Diffractive imaging of dissociation and ground-state dynamics in a complex molecule",2019,"Physical Review A","10.1103/PhysRevA.100.023402","https://www.scopus.com/inward/record.uri?eid=2-s2.0-85070552696&doi=10.1103%2fPhysRevA.100.023402&partnerID=40&md5=fa560b152858eb18c98f2f77369d1b77","U.S. Department of Energy; Basic Energy Sciences; Senter for Autonome Marine Operasjoner og Systemer; SLAC National Accelerator Laboratory; Chemical Sciences, Geosciences, and Biosciences Division; Volkswagen Foundation",,"English",Article,"All Open Access, Bronze, Green",Scopus
"Simultaneous biomethanisation of endogenous and imported CO2 in organically loaded anaerobic digesters",2019,"Applied Energy","10.1016/j.apenergy.2019.04.058","https://www.scopus.com/inward/record.uri?eid=2-s2.0-85064519648&doi=10.1016%2fj.apenergy.2019.04.058&partnerID=40&md5=e4a20503c9abc0cd1bcc40cafe13317a","Engineering and Physical Sciences Research Council","Tao, B.; Water and Environmental Engineering Group, University Road, United Kingdom; email: Bing.Tao@soton.ac.uk","English",Article,"All Open Access, Green",Scopus
"Flavonoid Versus Artemisinin Anti-malarial Activity in Artemisia annua Whole-Leaf Extracts",2019,"Frontiers in Plant Science","10.3389/fpls.2019.00984","https://www.scopus.com/inward/record.uri?eid=2-s2.0-85072201252&doi=10.3389%2ffpls.2019.00984&partnerID=40&md5=7c2ce18174873d7a05c529b7f8ac482b","Bill and Melinda Gates Foundation; Garfield Weston Foundation; Tertiary Education Trust Fund","Graham, I.A.; Centre for Novel Agricultural Products, United Kingdom; email: ian.graham@york.ac.uk","English",Article,"All Open Access, Gold, Green",Scopus
"A future in the knowledge economy? Analysing the career strategies of doctoral scientists through the principles of game theory",2019,"Higher Education","10.1007/s10734-018-0329-z","https://www.scopus.com/inward/record.uri?eid=2-s2.0-85056311017&doi=10.1007%2fs10734-018-0329-z&partnerID=40&md5=6fa7bbbb6db9307a986ca58018023ac8",,"Hancock, S.; Department of Education, United Kingdom; email: sally.hancock@york.ac.uk","English",Article,"All Open Access, Hybrid Gold, Green",Scopus
"Monitoring of individual bacteria using electro-photonic traps",2019,"Biomedical Optics Express","10.1364/BOE.10.003463","https://www.scopus.com/inward/record.uri?eid=2-s2.0-85070762010&doi=10.1364%2fBOE.10.003463&partnerID=40&md5=32cd0b94453859a0e70241f970ebcdcb","Engineering and Physical Sciences Research Council","Ciminelli, C.; Optoelectronics Laboratory, Via Orabona, 4, Italy; email: caterina.ciminelli@poliba.it","English",Article,"All Open Access, Gold, Green",Scopus
"The disutility of commuting? The effect of gender and local labor markets",2019,"Regional Science and Urban Economics","10.1016/j.regsciurbeco.2019.06.001","https://www.scopus.com/inward/record.uri?eid=2-s2.0-85067542631&doi=10.1016%2fj.regsciurbeco.2019.06.001&partnerID=40&md5=a8680f26a44a439be2b0658e35648c01","Medical Research Council; Economic and Social Research Council; Leverhulme Trust","Rice, N.; Centre for Health Economics & Department of Economics and Related Studies, United Kingdom; email: nigel.rice@york.ac.uk","English",Article,"All Open Access, Hybrid Gold, Green",Scopus
"Enhancing feasibility when measuring teachers' motivation: A brief scale for teachers’ achievement goal orientations",2019,"Teaching and Teacher Education","10.1016/j.tate.2019.04.003","https://www.scopus.com/inward/record.uri?eid=2-s2.0-85064069888&doi=10.1016%2fj.tate.2019.04.003&partnerID=40&md5=16c0532ec93d17a33e2dc227951bf5d2",,"Janke, S.; Department of Psychology, Germany; email: stefan.janke@uni-mannheim.de","English",Article,"",Scopus
"Biomarker evidence for the occurrence of anaerobic ammonium oxidation in the eastern Mediterranean Sea during Quaternary and Pliocene sapropel formation",2019,"Biogeosciences","10.5194/bg-16-2467-2019","https://www.scopus.com/inward/record.uri?eid=2-s2.0-85067648228&doi=10.5194%2fbg-16-2467-2019&partnerID=40&md5=9366216df3ebb064ca604e4a4f7bd0ed","Seventh Framework Programme; Natural Environment Research Council; European Commission; European Research Council; Nederlandse Organisatie voor Wetenschappelijk Onderzoek; Netherlands Earth System Science Centre","Rush, D.; Department of Marine Microbiology and Biogeochemistry, Netherlands; email: darci.rush@nioz.nl","English",Article,"All Open Access, Gold, Green",Scopus
"Using Explicit Instruction About L1 to Reduce Crosslinguistic Effects in L2 Grammar Learning: Evidence From Oral Production in L2 French",2019,"Modern Language Journal","10.1111/modl.12567","https://www.scopus.com/inward/record.uri?eid=2-s2.0-85065440913&doi=10.1111%2fmodl.12567&partnerID=40&md5=657ef389ed3a7b04dc24196d7e6c749c","British Academy",,"English",Article,"All Open Access, Green",Scopus
"From Henley to Harvard at Hyderabad? (Post and Neo-) Colonialism in Management Education in India",2019,"Enterprise and Society","10.1017/eso.2018.86","https://www.scopus.com/inward/record.uri?eid=2-s2.0-85064933295&doi=10.1017%2feso.2018.86&partnerID=40&md5=fee50ae20f386b57826db71f6526818f","Recruitment and Assesment Centre","Kumar, A.; University of York, LMB/226, Freboys Lane, United Kingdom; email: arun.kumar@york.ac.uk","English",Article,"All Open Access, Green",Scopus
"Lysozyme-Responsive Spray-Dried Chitosan Particles for Early Detection of Wound Infection",2019,"ACS Applied Bio Materials","10.1021/acsabm.9b00023","https://www.scopus.com/inward/record.uri?eid=2-s2.0-85072844581&doi=10.1021%2facsabm.9b00023&partnerID=40&md5=2472edcacea6f9009b90b2dea74cd564","Seventh Framework Programme; Austrian Science Fund","Tegl, G.; Institute for Environmental Biotechnology, Konrad-Lorenz-Strasse 20, Austria; email: gregor.tegl@gmail.com","English",Article,"All Open Access, Bronze, Green",Scopus
"From community wealth-building to system change",2019,"IPPR Progressive Review","10.1111/newe.12130","https://www.scopus.com/inward/record.uri?eid=2-s2.0-85062045569&doi=10.1111%2fnewe.12130&partnerID=40&md5=261e74fc67d144a8efd7f2187f1c81b9",,,"English",Note,"",Scopus
"On Biomineralization: Enzymes Switch on Mesocrystal Assembly",2019,"ACS Central Science","10.1021/acscentsci.8b00853","https://www.scopus.com/inward/record.uri?eid=2-s2.0-85061275599&doi=10.1021%2facscentsci.8b00853&partnerID=40&md5=4b4363bbd4d8182365d79bbd4be22754","Seventh Framework Programme; Engineering and Physical Sciences Research Council; European Research Council; Deutsche Forschungsgemeinschaft","Cölfen, H.; Physical Chemistry, Universitätsstr. 10, Germany; email: Helmut.Coelfen@uni-konstanz.de","English",Article,"All Open Access, Bronze, Green",Scopus
"Climate pioneership and leadership in structurally disadvantaged maritime port cities",2019,"Environmental Politics","10.1080/09644016.2019.1522039","https://www.scopus.com/inward/record.uri?eid=2-s2.0-85057092556&doi=10.1080%2f09644016.2019.1522039&partnerID=40&md5=cf4fa68223ab547f8ebc693de38f7c71","University of Hull; British Academy","Wurzel, R.K.W.; School of Law and Politics, United Kingdom; email: R.K.Wurzel@hull.ac.uk","English",Article,"All Open Access, Green",Scopus
"Understanding the structure and dynamics of hydrogenases by ultrafast and two-dimensional infrared spectroscopy",2019,"Chemical Science","10.1039/c9sc02851j","https://www.scopus.com/inward/record.uri?eid=2-s2.0-85073426438&doi=10.1039%2fc9sc02851j&partnerID=40&md5=2be99bee3aef796d789892a574f7a9f6","Science and Technology Facilities Council; Leverhulme Trust; Deutsche Forschungsgemeinschaft","Horch, M.; Department of Chemistry, United Kingdom; email: marius.horch@york.ac.uk","English",Article,"All Open Access, Gold, Green",Scopus
"Impact of Hardware Impairments on Outage Performance of Hybrid Satellite-Terrestrial Relay Systems",2019,"IEEE Access","10.1109/ACCESS.2019.2905129","https://www.scopus.com/inward/record.uri?eid=2-s2.0-85063903609&doi=10.1109%2fACCESS.2019.2905129&partnerID=40&md5=2236e1943d67254aa41b89f4b899e66b","National Natural Science Foundation of China; Natural Science Foundation of Jiangsu Province","Zou, Y.; State Key Lab. of Complex Electromagnetic Environ. Effects on Electronics and Information SystemChina; email: yulong.zou@njupt.edu.cn","English",Article,"All Open Access, Gold",Scopus
"X-ray phase-contrast imaging for laser-induced shock waves",2019,"EPL","10.1209/0295-5075/125/35002","https://www.scopus.com/inward/record.uri?eid=2-s2.0-85063586516&doi=10.1209%2f0295-5075%2f125%2f35002&partnerID=40&md5=1f4f86f2ebdef5f6d9ff5a1bf73e64ee","Lawrence Livermore National Laboratory; Intensive Care Foundation; Horizon 2020 Framework Programme; Engineering and Physical Sciences Research Council",,"English",Article,"All Open Access, Green",Scopus
"Delineating the critical role of acid additives in Mn-catalysed C-H bond functionalisation processes",2019,"Chemical Communications","10.1039/c9cc00257j","https://www.scopus.com/inward/record.uri?eid=2-s2.0-85062826714&doi=10.1039%2fc9cc00257j&partnerID=40&md5=876f079f0cae8e7dcd5631f25ae602cd","Engineering and Physical Sciences Research Council; Syngenta International","Lynam, J.M.; Department of Chemistry, United Kingdom; email: jason.lynam@york.ac.uk","English",Article,"All Open Access, Green",Scopus
"Runaway electron beam control",2019,"Plasma Physics and Controlled Fusion","10.1088/1361-6587/aaef53","https://www.scopus.com/inward/record.uri?eid=2-s2.0-85057828309&doi=10.1088%2f1361-6587%2faaef53&partnerID=40&md5=4f28cbdd8be14ea3d6a5fd20e04dfa2a","Horizon 2020 Framework Programme",,"English",Article,"All Open Access, Green",Scopus
"Measuring fast ions in fusion plasmas with neutron diagnostics at JET",2019,"Plasma Physics and Controlled Fusion","10.1088/1361-6587/aad8a6","https://www.scopus.com/inward/record.uri?eid=2-s2.0-85057607361&doi=10.1088%2f1361-6587%2faad8a6&partnerID=40&md5=e147173154e2dac9a1a04bd0664ead94","Horizon 2020 Framework Programme","Eriksson, J.; Department of Physics and Astronomy, Sweden; email: jacob.eriksson@physics.uu.se","English",Article,"All Open Access, Green",Scopus
"Integrating Green and Sustainable Chemistry into Undergraduate Teaching Laboratories: Closing and Assessing the Loop on the Basis of a Citrus Biorefinery Approach for the Biocircular Economy in Brazil",2019,"Journal of Chemical Education","10.1021/acs.jchemed.9b00286","https://www.scopus.com/inward/record.uri?eid=2-s2.0-85070998868&doi=10.1021%2facs.jchemed.9b00286&partnerID=40&md5=ef9b0cdf82f811aac4316e467d35c63e","International Union of Pure and Applied Chemistry; Fundação de Amparo à Pesquisa do Estado de São Paulo; Conselho Nacional de Desenvolvimento Científico e Tecnológico","Zuin, V.G.; Department of Chemistry, Rodovia Washington Luís (SP-310), km 235, Brazil; email: vaniaz@ufscar.br","English",Article,"",Scopus
"The Stickiness of Non-Religion? Intergenerational Transmission and the Formation of Non-Religious Identities in Childhood",2019,"Sociology","10.1177/0038038519855307","https://www.scopus.com/inward/record.uri?eid=2-s2.0-85068348671&doi=10.1177%2f0038038519855307&partnerID=40&md5=cf53c1166c12bea9fc168808415bb70d","John Templeton Foundation; University of Kent","Strhan, A.; University of YorkUnited Kingdom; email: anna.strhan@york.ac.uk","English",Article,"All Open Access, Green",Scopus
"Contrasting Nitrogen Fertilisation Rates Alter Mycorrhizal Contribution to Barley Nutrition in a Field Trial",2019,"Frontiers in Plant Science","10.3389/fpls.2019.01312","https://www.scopus.com/inward/record.uri?eid=2-s2.0-85075229945&doi=10.3389%2ffpls.2019.01312&partnerID=40&md5=c9518f102e5b1610288cbfed0c3810e0","Agricultural and Horticultural Development Board; Biotechnology and Biological Sciences Research Council","Thirkell, T.; Department of Biology, United Kingdom","English",Article,"All Open Access, Gold, Green",Scopus
"Toward Renewable-Based, Food-Applicable Prebiotics from Biomass: A One-Step, Additive-Free, Microwave-Assisted Hydrothermal Process for the Production of High Purity Xylo-oligosaccharides from Beech Wood Hemicellulose",2019,"ACS Sustainable Chemistry and Engineering","10.1021/acssuschemeng.9b03096","https://www.scopus.com/inward/record.uri?eid=2-s2.0-85073005056&doi=10.1021%2facssuschemeng.9b03096&partnerID=40&md5=3b43e860d7b2a6146078a310fbc08969","Engineering and Physical Sciences Research Council; Biotechnology and Biological Sciences Research Council","Remón, J.; Green Chemistry Centre of Excellence, Heslington, United Kingdom; email: jremon@icb.csic.es","English",Article,"All Open Access, Green",Scopus
"Impact of intravenous iron on oxidative stress and mitochondrial function in experimental chronic kidney disease",2019,"Antioxidants","10.3390/antiox8100498","https://www.scopus.com/inward/record.uri?eid=2-s2.0-85074223206&doi=10.3390%2fantiox8100498&partnerID=40&md5=8051157451e70a047c61d0bf7d79edf5","Takeda Pharmaceutical Company","Bhandari, S.; Hull York Medical School & Department of Renal Medicine, Anlaby Road, United Kingdom; email: Sunil.bhandari@hey.nhs.uk","English",Article,"All Open Access, Gold, Green",Scopus
"The development of seaweed-derived fuels in the UK: An analysis of stakeholder issues and public perceptions",2019,"Energy Policy","10.1016/j.enpol.2019.110924","https://www.scopus.com/inward/record.uri?eid=2-s2.0-85073700329&doi=10.1016%2fj.enpol.2019.110924&partnerID=40&md5=f52cf1e5307b469d323b3f97d7e02f31","","Wells, V.; The York Management SchoolUnited Kingdom; email: victoria.wells@york.ac.uk","English",Article,"All Open Access, Green",Scopus
"Focusing on the nuclear and subnuclear dynamics of light and circadian signalling",2019,"Plant Cell and Environment","10.1111/pce.13634","https://www.scopus.com/inward/record.uri?eid=2-s2.0-85070762098&doi=10.1111%2fpce.13634&partnerID=40&md5=e6273b86a28e6be6fbc5b68266aae3c3","University of York; Biotechnology and Biological Sciences Research Council","Davis, S.J.; Department of Biology, United Kingdom; email: seth.davis@york.ac.uk","English",Review,"All Open Access, Bronze, Green",Scopus
"Symmetry restoration in the mean-field description of proton-neutron pairing",2019,"Physics Letters, Section B: Nuclear, Elementary Particle and High-Energy Physics","10.1016/j.physletb.2019.06.032","https://www.scopus.com/inward/record.uri?eid=2-s2.0-85067405566&doi=10.1016%2fj.physletb.2019.06.032&partnerID=40&md5=4e32c7c0f2c3789a8bea3c9ef0c9f1f3","Science and Technology Facilities Council","Dobaczewski, J.; Department of Physics, United Kingdom; email: jacek.dobaczewski@york.ac.uk","English",Article,"All Open Access, Gold, Green",Scopus
"Characterization of painting pigments and ochres associated with the Hoabinhian archaeological context at the rock-shelter site of Doi Pha Kan (Thailand)",2019,"Journal of Archaeological Science: Reports","10.1016/j.jasrep.2019.05.020","https://www.scopus.com/inward/record.uri?eid=2-s2.0-85067312159&doi=10.1016%2fj.jasrep.2019.05.020&partnerID=40&md5=99d96857b95d998c650f6d0b76c9abe8","Ministère des Affaires Sociales et de la Santé; Muséum National d'Histoire Naturelle","Lebon, M.; UMR7194 - Histoire Naturelle de l'Homme Préhistorique (HNHP), Musée de l'Homme, 17, Place du Trocadéro, France; email: lebon@mnhn.fr","English",Article,"All Open Access, Bronze, Green",Scopus
"Testing DSGE Models by Indirect Inference: a Survey of Recent Findings",2019,"Open Economies Review","10.1007/s11079-019-09526-w","https://www.scopus.com/inward/record.uri?eid=2-s2.0-85062592987&doi=10.1007%2fs11079-019-09526-w&partnerID=40&md5=464567dc6b550e98e8de3d5db431ba6e","Cardiff University","Meenagh, D.; Cardiff Business School, Aberconway Building, Colum Drive, United Kingdom; email: Meenaghd@cf.ac.uk","English",Review,"All Open Access, Hybrid Gold, Green",Scopus
"Improved CRISPR/Cas9 gene editing by fluorescence activated cell sorting of green fluorescence protein tagged protoplasts",2019,"BMC Biotechnology","10.1186/s12896-019-0530-x","https://www.scopus.com/inward/record.uri?eid=2-s2.0-85067522143&doi=10.1186%2fs12896-019-0530-x&partnerID=40&md5=dc30cddd521454826f3d3139c17abea2","Villum Fonden; Danmarks Grundforskningsfond","Petersen, B.L.; Department of Plant and Environmental Sciences, Denmark; email: blp@plen.ku.dk","English",Article,"All Open Access, Gold, Green",Scopus
