"Teachers' perceptions about the etiology of intelligence and learning difficulties [Percepciones del Profesorado acerca de la Etiología de la Inteligencia y las Dificultades de Aprendizaje]",2019,"International Journal of Educational Psychology","10.17583/ijep.2019.3777","https://www.scopus.com/inward/record.uri?eid=2-s2.0-85069192941&doi=10.17583%2fijep.2019.3777&partnerID=40&md5=e053597053999130306d85a3faf6b775","Conselho Nacional de Desenvolvimento Científico e Tecnológico","Antonelli-Ponti, M.; Universidade de São PauloBrazil; email: antonelli.may@usp.br","English",Article,"All Open Access, Gold, Green",Scopus
"Manganese Carbonyl Compounds Reveal Ultrafast Metal-Solvent Interactions",2019,"Organometallics","10.1021/acs.organomet.9b00212","https://www.scopus.com/inward/record.uri?eid=2-s2.0-85066917291&doi=10.1021%2facs.organomet.9b00212&partnerID=40&md5=82130a62c6c190b78c1e61e5ae15b78f",,"Fairlamb, I.J.S.; Department of Chemistry, United Kingdom; email: ian.fairlamb@york.ac.uk","English",Article,"All Open Access, Green",Scopus
"Innovative Education and Training in high power laser plasmas (PowerLaPs) for plasma physics, high power laser-matter interactions and high energy density physics - Theory and experiments",2019,"High Power Laser Science and Engineering","10.1017/hpl.2019.7","https://www.scopus.com/inward/record.uri?eid=2-s2.0-85065326494&doi=10.1017%2fhpl.2019.7&partnerID=40&md5=6ccca89bfc4e11d2dc5243f27979f549","Engineering and Physical Sciences Research Council","Pasley, J.; York Plasma Institute, United Kingdom; email: john.pasley@york.ac.uk","English",Article,"All Open Access, Gold, Green",Scopus
"Single context archaeology as anarchist praxis",2019,"Journal of Contemporary Archaeology","10.1558/jca.33580","https://www.scopus.com/inward/record.uri?eid=2-s2.0-85065090966&doi=10.1558%2fjca.33580&partnerID=40&md5=a4d8cb7342353eaa2d3168aed60ddd05","European Research Council",,"English",Article,"All Open Access, Green",Scopus
"Interaural level difference optimization of binaural ambisonic rendering",2019,"Applied Sciences (Switzerland)","10.3390/app9061226","https://www.scopus.com/inward/record.uri?eid=2-s2.0-85063749380&doi=10.3390%2fapp9061226&partnerID=40&md5=002e16f38c1c1a404be42784e3917fa6","Google; Engineering and Physical Sciences Research Council","McKenzie, T.; AudioLab, United Kingdom; email: thomas.mckenzie@york.ac.uk","English",Article,"All Open Access, Gold, Green",Scopus
"Life-cycle assessment of microwave-assisted pectin extraction at pilot scale",2019,"ACS Sustainable Chemistry and Engineering","10.1021/acssuschemeng.8b06052","https://www.scopus.com/inward/record.uri?eid=2-s2.0-85062354968&doi=10.1021%2facssuschemeng.8b06052&partnerID=40&md5=0a1a85a73d9f61cdfebcd16bde63a2ac",,"Dugmore, T.I.J.; Green Chemistry Centre of Excellence, Innovation Way, Heslington, United Kingdom; email: tom.dugmore@york.ac.uk","English",Article,"All Open Access, Green",Scopus
"Quantitative In Situ Monitoring of Parahydrogen Fraction Using Raman Spectroscopy",2019,"Applied Spectroscopy","10.1177/0003702818798644","https://www.scopus.com/inward/record.uri?eid=2-s2.0-85059345575&doi=10.1177%2f0003702818798644&partnerID=40&md5=440505aa343f606dc0d51383f24f8f10","Medical Research Council; Engineering and Physical Sciences Research Council","Nordon, A.; WestCHEM, United Kingdom; email: alison.nordon@strath.ac.uk","English",Article,"All Open Access, Hybrid Gold, Green",Scopus
"The externalities of a deforestation control policy in infant health: Evidence from Brazil",2019,"Economic Development and Cultural Change","10.1086/698164","https://www.scopus.com/inward/record.uri?eid=2-s2.0-85057825438&doi=10.1086%2f698164&partnerID=40&md5=d2a7a6ba6feccc81916acd602c213518","Coordenação de Aperfeiçoamento de Pessoal de Nível Superior","Carrillo, B.; Federal University of VicosaBrazil; email: bladimir.bermudez@ufv.br","English",Article,"All Open Access, Green",Scopus
"Geography matters: The conditional effect of electoral systems on social spending",2019,"British Journal of Political Science","10.1017/S0007123416000338","https://www.scopus.com/inward/record.uri?eid=2-s2.0-85010886838&doi=10.1017%2fS0007123416000338&partnerID=40&md5=a1418436d3c06adf11c11d9a35d8a9de",,"Jurado, I.; Department of Politics, United Kingdom; email: ignacio.jurado@york.ac.uk","English",Review,"All Open Access, Bronze, Green",Scopus
"Executive compensation in less regulated markets: the impact of debt monitoring",2019,"European Journal of Finance","10.1080/1351847X.2019.1668448","https://www.scopus.com/inward/record.uri?eid=2-s2.0-85073564908&doi=10.1080%2f1351847X.2019.1668448&partnerID=40&md5=bfc93f1f28ce41a6b850724a07f0d63e",,"Marshall, A.; Department of Accounting and Finance, United Kingdom; email: a.marshall@strath.ac.uk","English",Article,"All Open Access, Green",Scopus
"A copper(II)-mediated radical cross-dehydrogenative coupling/sulfinic acid elimination approach to 2-quinolones",2019,"Tetrahedron","10.1016/j.tet.2019.130711","https://www.scopus.com/inward/record.uri?eid=2-s2.0-85074889413&doi=10.1016%2fj.tet.2019.130711&partnerID=40&md5=79186b13b0399fdf7a602e3ceff396b6","European Federation of Pharmaceutical Industries and Associations; Engineering and Physical Sciences Research Council; Seventh Framework Programme; Innovative Medicines Initiative","Taylor, R.J.K.; Department of Chemistry, Heslington, United Kingdom; email: richard.taylor@york.ac.uk","English",Article,"All Open Access, Green",Scopus
"Analyzing causal structures using Tsallis entropies",2019,"Physical Review A","10.1103/PhysRevA.100.062108","https://www.scopus.com/inward/record.uri?eid=2-s2.0-85076988667&doi=10.1103%2fPhysRevA.100.062108&partnerID=40&md5=71dce0187bd81a757c5ec58017224b0e","University of York; Engineering and Physical Sciences Research Council","Vilasini, V.; Department of Mathematics, United Kingdom; email: vv577@york.ac.uk","English",Article,"All Open Access, Green",Scopus
"The airtight protocol for mixed criticality wireless CPs",2019,"ACM Transactions on Cyber-Physical Systems","10.1145/3362987","https://www.scopus.com/inward/record.uri?eid=2-s2.0-85077788890&doi=10.1145%2f3362987&partnerID=40&md5=6bda4e7411aacb0a32384221c6d8fe8a","Engineering and Physical Sciences Research Council",,"English",Article,"All Open Access, Green",Scopus
"Subject, object, agent, other: Zoom, PNP and crystal methamphetamine",2019,"Somatechnics","10.3366/soma.2019.0287","https://www.scopus.com/inward/record.uri?eid=2-s2.0-85075230356&doi=10.3366%2fsoma.2019.0287&partnerID=40&md5=cf5055defebaf19a1116392fac4e0f8b",,"Ray, D.; York UniversityUnited Kingdom","English",Article,"",Scopus
"Inclusion of Research Materials When Submitting an Article to Language Learning",2019,"Language Learning","10.1111/lang.12378","https://www.scopus.com/inward/record.uri?eid=2-s2.0-85074195967&doi=10.1111%2flang.12378&partnerID=40&md5=224687aa518309e277e70354af08c7b0",,,"English",Editorial,"All Open Access, Bronze, Green",Scopus
"HAADF-STEM Image Resolution Enhancement Using High-Quality Image Reconstruction Techniques: Case of the Fe3O4(111) Surface",2019,"Microscopy and Microanalysis","10.1017/S1431927619014788","https://www.scopus.com/inward/record.uri?eid=2-s2.0-85071367667&doi=10.1017%2fS1431927619014788&partnerID=40&md5=fcd7aa1b49001382d8c5e9d5c775efe2",,"Bárcena-González, G.; Department of Computer Science and Engineering, Spain; email: guillermo.barcena@uca.es","English",Article,"All Open Access, Green",Scopus
"Presentations for singular wreath products",2019,"Journal of Pure and Applied Algebra","10.1016/j.jpaa.2019.03.013","https://www.scopus.com/inward/record.uri?eid=2-s2.0-85063073227&doi=10.1016%2fj.jpaa.2019.03.013&partnerID=40&md5=a2efe5f839d70070c8ae7c1821d0dafa","University of York; Ministarstvo Prosvete, Nauke i Tehnološkog Razvoja; Higher Committee for Education Development in Iraq; Foshan University","Dolinka, I.; Department of Mathematics and Informatics, Trg Dositeja Obradovića 4, Serbia; email: dockie@dmi.uns.ac.rs","English",Article,"All Open Access, Green",Scopus
"TESTING the ORDER of FRACTIONAL INTEGRATION of A TIME SERIES in the POSSIBLE PRESENCE of A TREND BREAK at AN UNKNOWN POINT",2019,"Econometric Theory","10.1017/S0266466618000361","https://www.scopus.com/inward/record.uri?eid=2-s2.0-85056724364&doi=10.1017%2fS0266466618000361&partnerID=40&md5=a9885ce08d6f824792e5a2b106ed3dcd","","Robert Taylor, A.M.; Essex Business School, United Kingdom; email: robert.taylor@essex.ac.uk","English",Article,"All Open Access, Green",Scopus
"‘Filip’ or flop? Managing public relations and the Latin American reaction to the 1966 FIFA World Cup",2019,"Soccer and Society","10.1080/14660970.2019.1680493","https://www.scopus.com/inward/record.uri?eid=2-s2.0-85074386372&doi=10.1080%2f14660970.2019.1680493&partnerID=40&md5=470f74d9d47056870799918d332c180f",,"Gillett, A.G.; The University of YorkUnited Kingdom; email: alex.gillett@york.ac.uk","English",Article,"All Open Access, Green",Scopus
"In situ SABRE hyperpolarization with earth's field NMR detection",2019,"Molecules","10.3390/molecules24224126","https://www.scopus.com/inward/record.uri?eid=2-s2.0-85074984663&doi=10.3390%2fmolecules24224126&partnerID=40&md5=2072d5f42ca8a9ecff0bf4444e364f6d","Wellcome Trust; Horizon 2020 Framework Programme; Medical Research Council; Engineering and Physical Sciences Research Council; Research Councils UK; Taif University","Halse, M.E.; Department of Chemistry, United Kingdom; email: meghan.halse@york.ac.uk","English",Article,"All Open Access, Gold, Green",Scopus
"Three-dimensional reflector localisation and room geometry estimation using a spherical microphone array",2019,"Journal of the Acoustical Society of America","10.1121/1.5130569","https://www.scopus.com/inward/record.uri?eid=2-s2.0-85075340898&doi=10.1121%2f1.5130569&partnerID=40&md5=30e35d01eb25a3b7c3213eec3e0f23f5","Engineering and Physical Sciences Research Council","Lovedee-Turner, M.; AudioLab, United Kingdom; email: mjlt500@york.ac.uk","English",Article,"All Open Access, Green",Scopus
"A contextual analysis of the late Roman Pewsey and Wilcot Vessel Hoards, Wiltshire",2019,"Britannia","10.1017/S0068113X19000266","https://www.scopus.com/inward/record.uri?eid=2-s2.0-85074071527&doi=10.1017%2fS0068113X19000266&partnerID=40&md5=c13f80ba78f047848a6e3abf988965e6",,,"English",Article,"All Open Access, Green",Scopus
"Buggery and Parliament, 1533–2017",2019,"Parliamentary History","10.1111/1750-0206.12463","https://www.scopus.com/inward/record.uri?eid=2-s2.0-85073463146&doi=10.1111%2f1750-0206.12463&partnerID=40&md5=2eee7eba07aaa10ec05b2220e9476f06","Conselho Nacional de Desenvolvimento CientÃ­fico e TecnolÃ³gico","Johnson, P.; University of YorkUnited Kingdom","English",Article,"All Open Access, Bronze, Green",Scopus
"Registered reports are an ally to early career researchers",2019,"Nature human behaviour","10.1038/s41562-019-0701-8","https://www.scopus.com/inward/record.uri?eid=2-s2.0-85073116967&doi=10.1038%2fs41562-019-0701-8&partnerID=40&md5=fc0323ddf7310b6d24113e181fbbaf4b",,,"English",Article,"All Open Access, Bronze",Scopus
"Estimating latent group structure in time-varying coefficient panel data models",2019,"Econometrics Journal","10.1093/ectj/utz008","https://www.scopus.com/inward/record.uri?eid=2-s2.0-85074138110&doi=10.1093%2fectj%2futz008&partnerID=40&md5=4a7fff73fb0f8852938b55ef4ac0a55d",,"Chen, J.; Department of Economics and Related Studies, Alcuin Way, United Kingdom; email: jia.chen@york.ac.uk","English",Article,"All Open Access, Green",Scopus
"Iron Age landscape changes in the Benoué River Valley, Cameroon",2019,"Quaternary Research (United States)","10.1017/qua.2019.25","https://www.scopus.com/inward/record.uri?eid=2-s2.0-85072666685&doi=10.1017%2fqua.2019.25&partnerID=40&md5=c8752d9e4fa0c71caaf4ab8397024671",,"Wright, D.K.; Department of Archaeology, Norway; email: daudi.wright@gmail.com","English",Article,"All Open Access, Green",Scopus
"Exploring severe mental illness and diabetes: Protocol for a longitudinal, observational, and qualitative mixed methods study",2019,"JMIR Research Protocols","10.2196/13407","https://www.scopus.com/inward/record.uri?eid=2-s2.0-85072644487&doi=10.2196%2f13407&partnerID=40&md5=2d477e402061fe208a9f74dedae17ced","National Institute for Health Research; Health Services and Delivery Research Programme","Bellass, S.; Mental Health and Addiction Research Group, United Kingdom; email: sue.bellass@york.ac.uk","English",Article,"All Open Access, Gold, Green",Scopus
"Job satisfaction amongst academic economists in the UK",2019,"Economics Letters","10.1016/j.econlet.2019.05.025","https://www.scopus.com/inward/record.uri?eid=2-s2.0-85066929523&doi=10.1016%2fj.econlet.2019.05.025&partnerID=40&md5=7331a74e1c1b2b514a92ad85cebb9990",,"Mumford, K.; Department of Economics, United Kingdom; email: karen.mumford@york.ac.uk","English",Article,"All Open Access, Green",Scopus
"Making sense of module feedback: accounting for individual behaviours in student evaluations of teaching",2019,"Assessment and Evaluation in Higher Education","10.1080/02602938.2018.1556777","https://www.scopus.com/inward/record.uri?eid=2-s2.0-85059482330&doi=10.1080%2f02602938.2018.1556777&partnerID=40&md5=34957f93a405bb6489f98871fc8d4840",,"Holland, E.P.; University of York, United Kingdom; email: pen.holland@york.ac.uk","English",Article,"",Scopus
"Discovery of 68Br in secondary reactions of radioactive beams",2019,"Physics Letters, Section B: Nuclear, Elementary Particle and High-Energy Physics","10.1016/j.physletb.2019.06.014","https://www.scopus.com/inward/record.uri?eid=2-s2.0-85067849206&doi=10.1016%2fj.physletb.2019.06.014&partnerID=40&md5=95cca1dcbffaacf4f8a5ffa764eb9399","H2020 European Research Council; Seventh Framework Programme; Science and Technology Facilities Council; European Research Council; Ministerio de Economía y Competitividad","Wimmer, K.; Department of Physics, 7-3-1 Hongo, Bunkyo-ku, Japan; email: wimmer@phys.s.u-tokyo.ac.jp","English",Article,"All Open Access, Gold, Green",Scopus
"Experimental demonstration of single-shot quantum and classical signal transmission on single wavelength optical pulse",2019,"Scientific reports","10.1038/s41598-019-47699-z","https://www.scopus.com/inward/record.uri?eid=2-s2.0-85070942722&doi=10.1038%2fs41598-019-47699-z&partnerID=40&md5=9a680325e80d0e388649013e4eb0d3c9","National Institutes of Health",,"English",Article,"All Open Access, Gold, Green",Scopus
"Untangling perceptions around indicators for biodiversity conservation and ecosystem services",2019,"Ecosystem Services","10.1016/j.ecoser.2019.100952","https://www.scopus.com/inward/record.uri?eid=2-s2.0-85066940618&doi=10.1016%2fj.ecoser.2019.100952&partnerID=40&md5=83e7e9532ef228db00dc97697af6f393","Instituto Nacional de Investigación y Tecnología Agraria y Alimentaria; Ministerio de Economía y Competitividad","Martínez-Jauregui, M.; National Institute for Agriculture and Food Research and Technology (INIA), Ctra. de La Coruña km. 7.5, Spain; email: martinez.maria@inia.es","English",Article,"All Open Access, Green",Scopus
"Principles into Policy: Assessing the Impact of Conservation Principles in Local Planning Policy",2019,"Historic Environment: Policy and Practice","10.1080/17567505.2019.1652401","https://www.scopus.com/inward/record.uri?eid=2-s2.0-85070817016&doi=10.1080%2f17567505.2019.1652401&partnerID=40&md5=1d1b2cff34dc21086432647d41035aed","Arts and Humanities Research Council","Chitty, G.; Department of Archaeology, United Kingdom; email: gill.chitty@york.ac.uk","English",Article,"All Open Access, Green",Scopus
"Responsible journalism, imitative suicide, and transgender populations: A systematic review of UK newspapers",2019,"Journal of Gay and Lesbian Mental Health","10.1080/19359705.2019.1620148","https://www.scopus.com/inward/record.uri?eid=2-s2.0-85069449043&doi=10.1080%2f19359705.2019.1620148&partnerID=40&md5=160a04f66aed929f7f9f1d7129591a32",,"McMillan, D.; Hull York Medical School, John Hughlings Jackson Building, University Rd, United Kingdom; email: jbolzern@doctors.org.uk","English",Review,"All Open Access, Green",Scopus
"Assessing strategic policy transfer in Romanian Public Management",2019,"Public Policy and Administration","10.1177/0952076717730427","https://www.scopus.com/inward/record.uri?eid=2-s2.0-85066412892&doi=10.1177%2f0952076717730427&partnerID=40&md5=b68d50badbb097b47bb84cb506538109",,"Common, R.; The University of YorkUnited Kingdom; email: richard.common@mbs.ac.uk","English",Article,"",Scopus
"A comparison of the minimum data sets for primary shoulder arthroplasty between national shoulder arthroplasty registries. Is international harmonization feasible?",2019,"Shoulder and Elbow","10.1177/1758573218755569","https://www.scopus.com/inward/record.uri?eid=2-s2.0-85053257486&doi=10.1177%2f1758573218755569&partnerID=40&md5=f8f21d6e9ab593c4e85cc62b1fd9a3a2",,"Rangan, A.; Department of Trauma Orthopaedics, United Kingdom; email: amar.rangan@york.ac.uk","English",Article,"All Open Access, Green",Scopus
"Investigation of the Δn = 0 selection rule in Gamow-Teller transitions: The β-decay of 207 Hg",2019,"Physics Letters, Section B: Nuclear, Elementary Particle and High-Energy Physics","10.1016/j.physletb.2019.04.039","https://www.scopus.com/inward/record.uri?eid=2-s2.0-85065199673&doi=10.1016%2fj.physletb.2019.04.039&partnerID=40&md5=cb2cb3b2220d289d2cdbd8887eba3278","Seventh Framework Programme; Department for Business, Energy and Industrial Strategy, UK Government; Science and Technology Facilities Council; European Commission; Belgian Federal Science Policy Office; Ministerio de Economía y Competitividad; Seventh Framework Programme; Ministerio de Economía, Industria y Competitividad, Gobierno de España; Suirbhéireacht Gheolaíochta Éireann; GSI Helmholtzzentrum für Schwerionenforschung","Berry, T.A.; Department of Physics, United Kingdom; email: t.berry@surrey.ac.uk","English",Article,"All Open Access, Gold, Green",Scopus
"Statistical Thermodynamics Unveils How Ions Influence an Aqueous Diels-Alder Reaction",2019,"ChemPhysChem","10.1002/cphc.201900024","https://www.scopus.com/inward/record.uri?eid=2-s2.0-85064735486&doi=10.1002%2fcphc.201900024&partnerID=40&md5=f309f1c13a25ebc2a2b905e22eb01b74",,"Shimizu, S.; York Structural Biology Laboratory Department of Chemistry, United Kingdom; email: seishi.shimizu@york.ac.uk","English",Article,"All Open Access, Green",Scopus
"Analysis of Sagunto Ibero-Roman votive bronze statuettes by portable X-ray fluorescence",2019,"Radiation Physics and Chemistry","10.1016/j.radphyschem.2019.02.031","https://www.scopus.com/inward/record.uri?eid=2-s2.0-85062285994&doi=10.1016%2fj.radphyschem.2019.02.031&partnerID=40&md5=134454f4da6831e603ce7a70303ecd13","Ministerio de Economía y Competitividad","Gallello, G.; Department of Analytical Chemistry, C/Dr. Moliner 50, Spain; email: gianni.gallello@york.ac.uk","English",Article,"All Open Access, Green",Scopus
"The response of different investor types to macroeconomic news",2019,"Journal of Multinational Financial Management","10.1016/j.mulfin.2019.02.005","https://www.scopus.com/inward/record.uri?eid=2-s2.0-85062274559&doi=10.1016%2fj.mulfin.2019.02.005&partnerID=40&md5=b7bb8e2783f918002156cab1cee2a790",,"Anderson, K.; The York Management School, Freboys Lane, Heslington, United Kingdom; email: keith.anderson@york.ac.uk","English",Article,"All Open Access, Green",Scopus
"Femtosecond laser-heating effect on the magnetization dynamics in perpendicularly magnetized Ta/CoFeB/MgO film",2019,"New Journal of Physics","10.1088/1367-2630/ab1fac","https://www.scopus.com/inward/record.uri?eid=2-s2.0-85069435595&doi=10.1088%2f1367-2630%2fab1fac&partnerID=40&md5=be1b7da80e8d37ffecf704ad681ebc27","National Key Research and Development Program of China","Xu, Y.; Jiangsu Provincial Key Laboratory of Advanced Photonic and Electronic Materials, China; email: ybxu@nju.edu.cn","English",Article,"All Open Access, Gold, Green",Scopus
"Socio-spatial agency and positive peace in Mostar, Bosnia and Herzegovina",2019,"Space and Polity","10.1080/13562576.2019.1641402","https://www.scopus.com/inward/record.uri?eid=2-s2.0-85073483697&doi=10.1080%2f13562576.2019.1641402&partnerID=40&md5=ebb0113afb7519920666fb6245e02088",,"Forde, S.; Department of Politics, United Kingdom; email: susan.forde@york.ac.uk","English",Article,"",Scopus
"Preytaxis and Travelling Waves in an Eco-epidemiological Model",2019,"Bulletin of Mathematical Biology","10.1007/s11538-018-00546-0","https://www.scopus.com/inward/record.uri?eid=2-s2.0-85058481430&doi=10.1007%2fs11538-018-00546-0&partnerID=40&md5=b552b6881aef49d5b1943345902b770e",,"Bate, A.M.; Environment Department, Heslington, United Kingdom; email: andrew.bate@york.ac.uk","English",Article,"All Open Access, Green",Scopus
"Sovereign debt: election concerns and the democratic disadvantage",2019,"Oxford Economic Papers","10.1093/oep/gpy036","https://www.scopus.com/inward/record.uri?eid=2-s2.0-85064172581&doi=10.1093%2foep%2fgpy036&partnerID=40&md5=b98bf6fd6026367f7e05af326eb9f3a1",,,"English",Article,"All Open Access, Green",Scopus
"Control of electron, ion and neutral heating in a radio-frequency electrothermal microthruster via dual-frequency voltage waveforms",2019,"Plasma Sources Science and Technology","10.1088/1361-6595/ab0984","https://www.scopus.com/inward/record.uri?eid=2-s2.0-85066278849&doi=10.1088%2f1361-6595%2fab0984&partnerID=40&md5=b0e51c795dc88e825d3b35e329905cff","Engineering and Physical Sciences Research Council","Doyle, S.J.; York Plasma Institute, United Kingdom; email: sjd549@york.ac.uk","English",Article,"All Open Access, Green",Scopus
"Gendered viewing, childbirth and female authority in the residence of alice chaucer, duchess of suffolk, at ewelme, oxfordshire",2019,"Journal of Medieval History","10.1080/03044181.2019.1593619","https://www.scopus.com/inward/record.uri?eid=2-s2.0-85063592411&doi=10.1080%2f03044181.2019.1593619&partnerID=40&md5=bf8834e44534049d90721e58f8bf24c3","British Archaeological Association; Arts and Humanities Research Council; University of Oxford","Delman, R.M.; Department of History, King’s Manor, United Kingdom; email: rachel.delman@york.ac.uk","English",Article,"All Open Access, Bronze",Scopus
"Mixed methods, mixed outcomes? Combining an RCT and case studies to research the impact of a training programme for primary school science teachers",2019,"International Journal of Science Education","10.1080/09500693.2018.1563729","https://www.scopus.com/inward/record.uri?eid=2-s2.0-85059678636&doi=10.1080%2f09500693.2018.1563729&partnerID=40&md5=8cf759dd74e0ebff612f2aec637d0b1f","Johns Hopkins University; Wellcome Trust; Chinese University of Hong Kong","Bennett, J.; Department of Education, United Kingdom; email: judith.bennett@york.ac.uk","English",Article,"All Open Access, Hybrid Gold, Green",Scopus
"Francis Bacon's doctrine of idols: A diagnosis of 'universal madness'",2019,"British Journal for the History of Science","10.1017/S0007087418000961","https://www.scopus.com/inward/record.uri?eid=2-s2.0-85060842374&doi=10.1017%2fS0007087418000961&partnerID=40&md5=74f73ac4db2bf00548e7708cd5077683",,"Weeks, S.V.; Department of History, United Kingdom; email: sophie.weeks@york.ac.uk","English",Article,"All Open Access, Green",Scopus
"Multi-core cyclic executives for safety-critical systems",2019,"Science of Computer Programming","10.1016/j.scico.2018.11.004","https://www.scopus.com/inward/record.uri?eid=2-s2.0-85057781870&doi=10.1016%2fj.scico.2018.11.004&partnerID=40&md5=c02d6c74df8a1124d3dfdae075330c6f","National Science Foundation; Directorate for Computer and Information Science and Engineering; Air Force Office of Scientific Research; Army Research Office; National Science Foundation","Baruah, S.; Washington University in St. LouisUnited States; email: baruah@wustl.edu","English",Article,"All Open Access, Bronze, Green",Scopus
"Overground endoscopic findings and respiratory sound analysis in horses with recurrent laryngeal neuropathy after unilateral laser ventriculocordectomy",2019,"Equine Veterinary Journal","10.1111/evj.12993","https://www.scopus.com/inward/record.uri?eid=2-s2.0-85052569132&doi=10.1111%2fevj.12993&partnerID=40&md5=9b1959965db39e409d2f57ac5f9d92b2",,"Barakzai, S.Z.; Equine Surgical ReferralsUnited Kingdom; email: safia@equinesurgicalreferrals.com","English",Article,"All Open Access, Green",Scopus
"Analysis of a multiple year gas sales agreement with make-up, carry-forward and indexation",2019,"Energy Economics","10.1016/j.eneco.2018.04.001","https://www.scopus.com/inward/record.uri?eid=2-s2.0-85045701447&doi=10.1016%2fj.eneco.2018.04.001&partnerID=40&md5=ec3b5b4331d8e57cadf25936f7cbff7f",,"Kang, B.; Department of Mathematics, Heslington, United Kingdom; email: boda.kang@york.ac.uk","English",Article,"All Open Access, Green",Scopus
"Badly approximable points on self-affine sponges and the lower Assouad dimension",2019,"Ergodic Theory and Dynamical Systems","10.1017/etds.2017.42","https://www.scopus.com/inward/record.uri?eid=2-s2.0-85021177898&doi=10.1017%2fetds.2017.42&partnerID=40&md5=28f551cbf73cbcc4aaea1ffc95b801dc","Directorate for Mathematical and Physical Sciences",,"English",Article,"All Open Access, Hybrid Gold, Green",Scopus
"Finite ion orbit width effect on the neoclassical tearing mode threshold in a tokamak plasma",2019,"Nuclear Fusion","10.1088/1741-4326/ab00ba","https://www.scopus.com/inward/record.uri?eid=2-s2.0-85064081787&doi=10.1088%2f1741-4326%2fab00ba&partnerID=40&md5=0602a9d349cd8e1714e9250027fa5e25","Horizon 2020 Framework Programme",,"English",Article,"All Open Access, Hybrid Gold, Green",Scopus
