"A new beamline for laser spin-polarization at ISOLDE",2019,"Nuclear Instruments and Methods in Physics Research, Section A: Accelerators, Spectrometers, Detectors and Associated Equipment","10.1016/j.nima.2019.01.082","https://www.scopus.com/inward/record.uri?eid=2-s2.0-85061131939&doi=10.1016%2fj.nima.2019.01.082&partnerID=40&md5=4521581f78c0a9dbc1a0410349d9934e","Horizon 2020 Framework Programme; H2020 European Research Council; European Resuscitation Council; Science and Technology Facilities Council; KU Leuven; Vlaamse regering","Gins, W.; KU Leuven, Belgium; email: wouter.gins@fys.kuleuven.be","English",Article,"All Open Access, Hybrid Gold, Green",Scopus
"Across the Board: Michael North on Carbon Dioxide Biorefinery",2019,"ChemSusChem","10.1002/cssc.201900676","https://www.scopus.com/inward/record.uri?eid=2-s2.0-85063776241&doi=10.1002%2fcssc.201900676&partnerID=40&md5=7b89c086f30f05243be1d672c0f45f92","Engineering and Physical Sciences Research Council; EPSRC Centre for Doctoral Training in Medical Imaging","North, M.; Green Chemistry Centre of Excellence, United Kingdom; email: Michael.north@york.ac.uk","English",Note,"All Open Access, Green",Scopus
"Considering the team in team formulation: a systematic review",2019,"Mental Health Review Journal","10.1108/MHRJ-12-2017-0055","https://www.scopus.com/inward/record.uri?eid=2-s2.0-85060586292&doi=10.1108%2fMHRJ-12-2017-0055&partnerID=40&md5=77018e13c706e3b10d438c3ea8ee3139",,"Short, V.; Department of Psychology, United Kingdom; email: valentina.short@durham.ac.uk","English",Review,"All Open Access, Bronze, Green",Scopus
"Probability distributions for the stress tensor in conformal field theories",2019,"Letters in Mathematical Physics","10.1007/s11005-018-1124-6","https://www.scopus.com/inward/record.uri?eid=2-s2.0-85053466615&doi=10.1007%2fs11005-018-1124-6&partnerID=40&md5=a2c023c2c8fd85ca3fa214cd854b51f3","Kavli Institute for Theoretical Physics, University of California, Santa Barbara","Fewster, C.J.; Department of Mathematics, United Kingdom; email: chris.fewster@york.ac.uk","English",Article,"All Open Access, Hybrid Gold, Green",Scopus
"DNA replication roadblocks caused by Cascade interference complexes are alleviated by RecG DNA repair helicase",2019,"RNA Biology","10.1080/15476286.2018.1496773","https://www.scopus.com/inward/record.uri?eid=2-s2.0-85051988705&doi=10.1080%2f15476286.2018.1496773&partnerID=40&md5=fd0805efb576dc302a8fcbb8c8aea9d7","Biotechnology and Biological Sciences Research Council","Bolt, E.L.; School of Life Sciences, United Kingdom; email: ed.bolt@nottingham.ac.uk","English",Article,"All Open Access, Hybrid Gold, Green",Scopus
"Reduced-dimension space-time adaptive processing with sparse constraints on beam-Doppler selection",2019,"Signal Processing","10.1016/j.sigpro.2018.11.013","https://www.scopus.com/inward/record.uri?eid=2-s2.0-85057178789&doi=10.1016%2fj.sigpro.2018.11.013&partnerID=40&md5=7420df484b6ecd4c703aca1dec938b7d","National Natural Science Foundation of China","Wang, Z.; Department of Electronic Engineering, China; email: wangzetao12@126.com","English",Article,"",Scopus
"Stochastic Landau–Lifshitz–Gilbert equation with anisotropy energy driven by pure jump noise",2019,"Computers and Mathematics with Applications","10.1016/j.camwa.2018.08.009","https://www.scopus.com/inward/record.uri?eid=2-s2.0-85051661859&doi=10.1016%2fj.camwa.2018.08.009&partnerID=40&md5=475b218eac1722932658bbe0e565087d","Royal Society","Brzeźniak, Z.; Department of Mathematics, Heslington, United Kingdom; email: zdzislaw.brzezniak@york.ac.uk","English",Article,"All Open Access, Bronze, Green",Scopus
"Multiphysics analysis with CAD-based parametric breeding blanket creation for rapid design iteration",2019,"Nuclear Fusion","10.1088/1741-4326/ab0016","https://www.scopus.com/inward/record.uri?eid=2-s2.0-85064086509&doi=10.1088%2f1741-4326%2fab0016&partnerID=40&md5=a9617d0a80991b6498cd7d6f8ffea648","Horizon 2020 Framework Programme",,"English",Article,"All Open Access, Hybrid Gold",Scopus
"Still unjust, just in different ways: How targeted sanctions fall short of just war theory’s principles",2019,"International Studies Review","10.1093/isr/viy012","https://www.scopus.com/inward/record.uri?eid=2-s2.0-85063942333&doi=10.1093%2fisr%2fviy012&partnerID=40&md5=21b608156d8a583b8da6c7e1e11ef12b",,,"English",Review,"",Scopus
"Poisoning causing the decline in South-East Asia's largest vulture population",2019,"Bird Conservation International","10.1017/S0959270918000126","https://www.scopus.com/inward/record.uri?eid=2-s2.0-85055356066&doi=10.1017%2fS0959270918000126&partnerID=40&md5=b94fcfdd463c2def3ac8e6f62f632c50",,"Loveridge, R.; BirdLife International Cambodia Programme, # 32A, St 494, Phsar Deurm Tkov, Cambodia; email: robin.loveridge@gmail.com","English",Article,"All Open Access, Bronze",Scopus
"Wavelength-dependent variations of the electron characteristics in laser-induced plasmas: A combined hydrodynamic and adiabatic expansion modelling and time-gated, optical emission imaging study",2019,"Journal of Applied Physics","10.1063/1.5052392","https://www.scopus.com/inward/record.uri?eid=2-s2.0-85062206661&doi=10.1063%2f1.5052392&partnerID=40&md5=ec3f101ab5f31ff1a297cbf829a00ff8","Engineering and Physical Sciences Research Council; University of Bristol; China Scholarship Council","Ashfold, M.N.R.; School of Chemistry, United Kingdom; email: mike.ashfold@bristol.ac.uk","English",Article,"All Open Access, Green",Scopus
"Toward the limit of nuclear binding on the N=Z line: Spectroscopy of Cd 96",2019,"Physical Review C","10.1103/PhysRevC.99.021302","https://www.scopus.com/inward/record.uri?eid=2-s2.0-85061786087&doi=10.1103%2fPhysRevC.99.021302&partnerID=40&md5=9d8f9eaa8e1288eae9593d1b7b5323e2","U.S. Department of Energy; Natural Sciences and Engineering Research Council of Canada; Science and Technology Facilities Council; Bundesministerium für Bildung und Forschung; Ministerio de Economía y Competitividad",,"English",Article,"All Open Access, Bronze, Green",Scopus
"Deuteron photodisintegration by polarized photons in the region of the d⁎(2380)",2019,"Physics Letters, Section B: Nuclear, Elementary Particle and High-Energy Physics","10.1016/j.physletb.2018.12.026","https://www.scopus.com/inward/record.uri?eid=2-s2.0-85058686111&doi=10.1016%2fj.physletb.2018.12.026&partnerID=40&md5=8fa198e54d7f3ca7b679f280c4c0dd70","National Science Foundation; U.S. Department of Energy; Sixth Framework Programme; Natural Sciences and Engineering Research Council of Canada; Science and Technology Facilities Council; Deutsche Forschungsgemeinschaft; Schweizerischer Nationalfonds zur Förderung der Wissenschaftlichen Forschung; Instituto Nazionale di Fisica Nucleare","Bashkanov, M.; Department of Physics, Heslington, United Kingdom; email: mikhail.bashkanov@york.ac.uk","English",Article,"All Open Access, Gold, Green",Scopus
"Integrated Photonic and Plasmonic Resonant Devices for Label-Free Biosensing and Trapping at the Nanoscale",2019,"Physica Status Solidi (A) Applications and Materials Science","10.1002/pssa.201800561","https://www.scopus.com/inward/record.uri?eid=2-s2.0-85058396263&doi=10.1002%2fpssa.201800561&partnerID=40&md5=73a03002e447221ccf75f3b2a63c6b48",,"Ciminelli, C.; Optoelectronics Laboratory, Via E. Orabona, 4, Italy; email: caterina.ciminelli@poliba.it","English",Article,"",Scopus
"Observation of excited states in Mg 20 sheds light on nuclear forces and shell evolution",2019,"Physical Review C","10.1103/PhysRevC.99.021301","https://www.scopus.com/inward/record.uri?eid=2-s2.0-85061280962&doi=10.1103%2fPhysRevC.99.021301&partnerID=40&md5=ad917ef2802507fd95fda4f9ba584517","U.S. Department of Energy; Office of Science; Nuclear Physics; Lawrence Livermore National Laboratory; Oak Ridge National Laboratory; Nova Scotia Research Innovation Trust; UT-Battelle; Natural Sciences and Engineering Research Council of Canada; Canada Foundation for Innovation; Deutscher Akademischer Austauschdienst",,"English",Article,"All Open Access, Bronze, Green",Scopus
"The impact of digging on the evolution of the rodent mandible",2019,"Journal of Morphology","10.1002/jmor.20929","https://www.scopus.com/inward/record.uri?eid=2-s2.0-85058838182&doi=10.1002%2fjmor.20929&partnerID=40&md5=90de4a1bc0e293172dee210776282d99","Natural Environment Research Council; University of Pretoria; Université de Montpellier","McIntosh, A.F.; Department of Science, United States; email: amcintosh@abac.edu","English",Article,"All Open Access, Green",Scopus
"Probing Conformational Heterogeneity at the Ionic Liquid-Vacuum Interface by Reactive-Atom Scattering",2019,"Journal of Physical Chemistry Letters","10.1021/acs.jpclett.8b02920","https://www.scopus.com/inward/record.uri?eid=2-s2.0-85060160168&doi=10.1021%2facs.jpclett.8b02920&partnerID=40&md5=2fbac049eb49cd6e174e4f2720e7c7ba","National Science Foundation; Engineering and Physical Sciences Research Council; National Science Foundation","Minton, T.K.; Department of Chemistry and Biochemistry, United States; email: tminton@montana.edu","English",Article,"All Open Access, Green",Scopus
"Enantioselective Lithiation–substitution of nitrogen-containing heterocycles",2019,"Organic Reactions","10.1002/0471264180.or100.05","https://www.scopus.com/inward/record.uri?eid=2-s2.0-85077313397&doi=10.1002%2f0471264180.or100.05&partnerID=40&md5=8ca95ad21db2a13d7ea339cc54f023fc","Engineering and Physical Sciences Research Council","O’Brien, P.; Department of Chemistry, United Kingdom; email: peter.obrien@york.ac.uk","English",Article,"",Scopus
"Cryptanalysis and improvement of a chaotic map-control-based and the plain image-related cryptosystem",2019,"Computers, Materials and Continua","10.32604/cmc.2019.05633","https://www.scopus.com/inward/record.uri?eid=2-s2.0-85075266078&doi=10.32604%2fcmc.2019.05633&partnerID=40&md5=1c6760e5c70e9c5a1cadc1c100b020ca","National Natural Science Foundation of China","Ge, X.; China National Digital Switching System Engineering Technology Research CenterChina; email: gexin_er@126.com","English",Article,"All Open Access, Gold",Scopus
"Revisiting the use of 'counselling' as a means of preparing prospective parents to meet the emerging psychosocial needs of families that have used gamete donation",2019,"Families, Relationships and Societies","10.1332/204674318X15313158773308","https://www.scopus.com/inward/record.uri?eid=2-s2.0-85070556516&doi=10.1332%2f204674318X15313158773308&partnerID=40&md5=88c8a2edeacee603e0e68c3560425632",,,"English",Article,"",Scopus
"Estimating on-road vehicle fuel economy in Africa: A case study based on an urban transport survey in Nairobi, Kenya",2019,"Energies","10.3390/en12061177","https://www.scopus.com/inward/record.uri?eid=2-s2.0-85065961000&doi=10.3390%2fen12061177&partnerID=40&md5=58f758337f5eb914af9ddc99acced15e","Schlumberger Foundation; University of York; Stockholm Environment Institute","Mbandi, A.M.; Stockholm Environment Institute, Wentworth Way, United Kingdom; email: aderiana.mbandi@sei.org","English",Article,"All Open Access, Gold, Green",Scopus
"Role of exchange parameters for ultrafast thermally induced magnetization switching in ferrimagnets",2019,"Physical Review B","10.1103/PhysRevB.99.184401","https://www.scopus.com/inward/record.uri?eid=2-s2.0-85065505164&doi=10.1103%2fPhysRevB.99.184401&partnerID=40&md5=f0b8761fb5c72519877be69c5956bece","European Cooperation in Science and Technology",,"English",Article,"",Scopus
"Steganalysis of Content-Adaptive Steganography Based on Massive Datasets Pre-Classification and Feature Selection",2019,"IEEE Access","10.1109/ACCESS.2019.2896781","https://www.scopus.com/inward/record.uri?eid=2-s2.0-85062879157&doi=10.1109%2fACCESS.2019.2896781&partnerID=40&md5=47060ab03fcba4d40df71f84b9705d35","National Natural Science Foundation of China","Yang, C.; Zhengzhou Science and Technology InstituteChina; email: chunfangyang@126.com","English",Article,"All Open Access, Gold",Scopus
"Using automated glycan assembly (AGA) for the practical synthesis of heparan sulfate oligosaccharide precursors",2019,"Organic and Biomolecular Chemistry","10.1039/c8ob02756k","https://www.scopus.com/inward/record.uri?eid=2-s2.0-85061493530&doi=10.1039%2fc8ob02756k&partnerID=40&md5=2bc921eb0e3de6995259ad204dc85309","University of York; Engineering and Physical Sciences Research Council; Biotechnology and Biological Sciences Research Council; Royal Society","Schwörer, R.; Ferrier Research Institute, 69 Gracefield Road Gracefield, New Zealand; email: ralf.schwoerer@vuw.ac.nz","English",Article,"All Open Access, Green",Scopus
"Observations of iodine oxide in the Indian Ocean marine boundary layer: A transect from the tropics to the high latitudes",2019,"Atmospheric Environment: X","10.1016/j.aeaoa.2019.100016","https://www.scopus.com/inward/record.uri?eid=2-s2.0-85060847634&doi=10.1016%2fj.aeaoa.2019.100016&partnerID=40&md5=826a9249db39046cd5c76087e85e8bc1","Natural Environment Research Council; Ministry of Earth Sciences","Mahajan, A.S.; Centre for Climate Change Research, India; email: anoop@tropmet.res.in","English",Article,"All Open Access, Gold, Green",Scopus
"Photochemistry of 2-butenedial and 4-oxo-2-pentenal under atmospheric boundary layer conditions",2019,"Physical Chemistry Chemical Physics","10.1039/c8cp06437g","https://www.scopus.com/inward/record.uri?eid=2-s2.0-85060119033&doi=10.1039%2fc8cp06437g&partnerID=40&md5=cf72f92f8483ec3c8b1b1e74a849710b","Fidelity Investments; Horizon 2020 Framework Programme; Natural Environment Research Council; National Eye Research Centre","Newland, M.J.; Wolfson Atmospheric Chemistry Laboratories, United Kingdom; email: mike.newland@york.ac.uk","English",Article,"All Open Access, Green",Scopus
"Conditional channel simulation",2019,"Annals of Physics","10.1016/j.aop.2018.11.014","https://www.scopus.com/inward/record.uri?eid=2-s2.0-85058170630&doi=10.1016%2fj.aop.2018.11.014&partnerID=40&md5=f013b3bcdf3c5115dbcf77d3cc46667a","Horizon 2020 Framework Programme; Engineering and Physical Sciences Research Council; European Commission","Pirandola, S.; Department of Computer Science, United Kingdom; email: stefano.pirandola@york.ac.uk","English",Article,"All Open Access, Green",Scopus
"Comparison of automated crystallographic model-building pipelines Alharbi Emad",2019,"Acta Crystallographica Section D: Structural Biology","10.1107/S2059798319014918","https://www.scopus.com/inward/record.uri?eid=2-s2.0-85075943840&doi=10.1107%2fS2059798319014918&partnerID=40&md5=b6f6c7f855fe182506ffc618c49fb126","University of Tabuk; Biotechnology and Biological Sciences Research Council","Alharbi, E.; Department of Computer Science, United Kingdom; email: emad.alharbi@york.ac.uk","English",Article,"All Open Access, Green",Scopus
"Identification of the First Gene Transfer Agent (GTA) Small Terminase in Rhodobacter capsulatus and Its Role in GTA Production and Packaging of DNA",2019,"Journal of Virology","10.1128/JVI.01328-19","https://www.scopus.com/inward/record.uri?eid=2-s2.0-85074963988&doi=10.1128%2fJVI.01328-19&partnerID=40&md5=174669284f2212c2269cf28a60498353","City, University of London; Engineering and Physical Sciences Research Council","Fogg, P.C.M.; Biology Department, United Kingdom; email: paul.fogg@york.ac.uk","English",Article,"All Open Access, Hybrid Gold, Green",Scopus
"Active sound production of scarab beetle larvae opens up new possibilities for species-specific pest monitoring in soils",2019,"Scientific Reports","10.1038/s41598-019-46121-y","https://www.scopus.com/inward/record.uri?eid=2-s2.0-85068972084&doi=10.1038%2fs41598-019-46121-y&partnerID=40&md5=057c3ef4b9cdc0e7d8a4e5b0c3df1441","Horizon 2020 Framework Programme; H2020 Marie Skłodowska-Curie Actions","Görres, C.-M.; Department of Applied Ecology, Germany; email: carolyn.goerres@hs-gm.de","English",Article,"All Open Access, Gold, Green",Scopus
"Phenomenal differences: Varieties of historical interpretation in management and organization studies",2019,"Qualitative Research in Organizations and Management: An International Journal","10.1108/QROM-08-2019-1808","https://www.scopus.com/inward/record.uri?eid=2-s2.0-85075389308&doi=10.1108%2fQROM-08-2019-1808&partnerID=40&md5=546622af1bbdcd7258c718679369b9c6",,"Mollan, S.; Management School, United Kingdom; email: Simon.Mollan@york.ac.uk","English",Article,"All Open Access, Green",Scopus
"Single-particle structure of neutron-rich Sr isotopes via H 2 (Sr 94,95,96, p) reactions",2019,"Physical Review C","10.1103/PhysRevC.100.054321","https://www.scopus.com/inward/record.uri?eid=2-s2.0-85075785282&doi=10.1103%2fPhysRevC.100.054321&partnerID=40&md5=d4cfc7a2c3bfc793d08ab562278d71d4","National Science Foundation; Cognitive Sciences and Technologies Council; Natural Sciences and Engineering Research Council of Canada; National Research Council Canada; Science and Technology Facilities Council; Universiteit Stellenbosch; Centre National de la Recherche Scientifique; British Columbia Knowledge Development Fund",,"English",Article,"All Open Access, Green",Scopus
"A Study of Knowledge, Experience, and Beliefs About Hepatitis B Virus (HBV) Infection in South Western Uganda",2019,"Frontiers in Public Health","10.3389/fpubh.2019.00304","https://www.scopus.com/inward/record.uri?eid=2-s2.0-85075247407&doi=10.3389%2ffpubh.2019.00304&partnerID=40&md5=10995570f5d5057d3f2b676220002bb4","London School of Hygiene and Tropical Medicine; Wellcome Trust; Global Challenges Research Fund; Medical Research Council; Department for International Development, UK Government; European Commission","Matthews, P.C.; Nuffield Department of Medicine, United Kingdom; email: philippa.matthews@ndm.ox.ac.uk","English",Article,"All Open Access, Gold, Green",Scopus
"Neutrophil elastase promotes Leishmania donovani infection via interferon-β",2019,"FASEB Journal","10.1096/fj.201900524R","https://www.scopus.com/inward/record.uri?eid=2-s2.0-85072716848&doi=10.1096%2ffj.201900524R&partnerID=40&md5=69362e222a85991be15a8a3f9a687458","Conselho Nacional de Desenvolvimento Científico e Tecnológico; Fundação Carlos Chagas Filho de Amparo à Pesquisa do Estado do Rio de Janeiro; Centre National de la Recherche Scientifique; Universidade Federal do Rio de Janeiro","Dias, B.T.; Instituto de Biofisica Carlos Chagas Filho, Brazil; email: anapaula@biof.ufrj.br","English",Article,"All Open Access, Hybrid Gold, Green",Scopus
"Biochemical characterization and low-resolution SAXS shape of a novel GH11 exo-1,4-β-xylanase identified in a microbial consortium",2019,"Applied Microbiology and Biotechnology","10.1007/s00253-019-10033-8","https://www.scopus.com/inward/record.uri?eid=2-s2.0-85070909182&doi=10.1007%2fs00253-019-10033-8&partnerID=40&md5=7e341b83c7da4198e35f263ba5e9c58a","National Institutes of Health; Fundação de Amparo à Pesquisa do Estado de São Paulo; Conselho Nacional de Desenvolvimento Científico e Tecnológico","Polikarpov, I.; Instituto de Física de São Carlos, Avenida Trabalhador São-carlense 400, Brazil; email: ipolikarpov@ifsc.usp.br","English",Article,"All Open Access, Green",Scopus
"A wall-aligned grid generator for non-linear simulations of MHD instabilities in tokamak plasmas",2019,"Computer Physics Communications","10.1016/j.cpc.2019.05.007","https://www.scopus.com/inward/record.uri?eid=2-s2.0-85066828087&doi=10.1016%2fj.cpc.2019.05.007&partnerID=40&md5=db8b5d4b76ba709d70ce570b3bb9cfce","Horizon 2020 Framework Programme; H2020 Euratom; Euratom Research and Training Programme; Engineering and Physical Sciences Research Council; Research Councils UK; European Commission; Japan Atomic Energy Agency","Pamela, S.; CCFE, United Kingdom","English",Article,"All Open Access, Green",Scopus
"Dynamics of scrape-off layer filaments in high β plasmas",2019,"Plasma Physics and Controlled Fusion","10.1088/1361-6587/ab34f8","https://www.scopus.com/inward/record.uri?eid=2-s2.0-85072951939&doi=10.1088%2f1361-6587%2fab34f8&partnerID=40&md5=8414be054b165e0a8e021fbb836acd87","Engineering and Physical Sciences Research Council","Militello, F.; Culham Centre for Fusion EnergyUnited Kingdom; email: fulvio.militello@ukaea.uk","English",Article,"",Scopus
"“It’s Us, You Know, There’s a Feeling of Community”: Exploring Notions of Community in a Consumer Co-operative",2019,"Journal of Business Ethics","10.1007/s10551-017-3747-4","https://www.scopus.com/inward/record.uri?eid=2-s2.0-85035080737&doi=10.1007%2fs10551-017-3747-4&partnerID=40&md5=804fd1ca8849f39811c319bba05ef9a6",,"Wells, V.; The York Management School, United Kingdom; email: victoria.wells@york.ac.uk","English",Article,"All Open Access, Green",Scopus
"Synthetic and Mechanistic Studies into the Rearrangement of Spirocyclic Indolenines into Quinolines",2019,"European Journal of Organic Chemistry","10.1002/ejoc.201900798","https://www.scopus.com/inward/record.uri?eid=2-s2.0-85071566987&doi=10.1002%2fejoc.201900798&partnerID=40&md5=7721b68a5bfdeec25898bf6083d4592c","University of York; Engineering and Physical Sciences Research Council; Leverhulme Trust","Unsworth, W.P.; Department of Chemistry, United Kingdom; email: william.unsworth@york.ac.uk","English",Article,"All Open Access, Green",Scopus
"A new semiparametric estimation approach for large dynamic covariance matrices with multiple conditioning variables",2019,"Journal of Econometrics","10.1016/j.jeconom.2019.04.025","https://www.scopus.com/inward/record.uri?eid=2-s2.0-85065078802&doi=10.1016%2fj.jeconom.2019.04.025&partnerID=40&md5=4578ed9a3c71a236c5c933063e29e536",,"Linton, O.; Faculty of Economics, United Kingdom; email: obl20@cam.ac.uk","English",Article,"All Open Access, Green",Scopus
"Low-temperature crystallisation of Heusler alloy films with perpendicular magnetic anisotropy",2019,"Journal of Magnetism and Magnetic Materials","10.1016/j.jmmm.2019.04.008","https://www.scopus.com/inward/record.uri?eid=2-s2.0-85063917007&doi=10.1016%2fj.jmmm.2019.04.008&partnerID=40&md5=081d4292ea636b6b5a427ffad126f06e",,"Frost, W.; Department of Electronic Engineering, United Kingdom; email: william.frost@york.ac.uk","English",Article,"All Open Access, Green",Scopus
"Cognitive load elevates discrimination thresholds of duration, intensity, and f 0 for a synthesized vowel",2019,"Journal of the Acoustical Society of America","10.1121/1.5120404","https://www.scopus.com/inward/record.uri?eid=2-s2.0-85070704117&doi=10.1121%2f1.5120404&partnerID=40&md5=6550544fe0d6e315f30a7f4252352762","Economic and Social Research Council",,"English",Article,"All Open Access, Hybrid Gold, Green",Scopus
"Solutions for Underwater Communication and Positioning Network Development",2019,"Gyroscopy and Navigation","10.1134/S2075108719030040","https://www.scopus.com/inward/record.uri?eid=2-s2.0-85071854744&doi=10.1134%2fS2075108719030040&partnerID=40&md5=4e7feed80e997dcf0b75427817dd2f6b","Russian Foundation for Basic Research","Kebkal, K.G.; Evologics GmbHGermany; email: kebkal@evologics.de","English",Article,"All Open Access, Green",Scopus
"High-throughput recovery and characterization of metagenome-derived glycoside hydrolase-containing clones as a resource for biocatalyst development",2019,"mSystems","10.1128/mSystems.00082-19","https://www.scopus.com/inward/record.uri?eid=2-s2.0-85067387158&doi=10.1128%2fmSystems.00082-19&partnerID=40&md5=f4ea0cd5c600f613201e18eef5bb8b1e","Canadian Institute for Advanced Research; Genome Canada; Natural Sciences and Engineering Research Council of Canada; Canada Foundation for Innovation; Genome British Columbia; University of British Columbia","Withers, S.G.; Genome Science and Technology Program, Canada; email: withers@chem.ubc.ca","English",Article,"All Open Access, Gold, Green",Scopus
"Single image super resolution via neighbor reconstruction",2019,"Pattern Recognition Letters","10.1016/j.patrec.2019.04.021","https://www.scopus.com/inward/record.uri?eid=2-s2.0-85064681846&doi=10.1016%2fj.patrec.2019.04.021&partnerID=40&md5=0e731c5e420584b5d3b9acd4042c40ad","Guangdong Power Grid Company","Wang, Z.; The Hong Kong Polytechnic UniversityHong Kong; email: jerry.wang@connect.polyu.hk","English",Article,"All Open Access, Green",Scopus
"Special Issue on Cognitive Load Theory: Editorial",2019,"Educational Psychology Review","10.1007/s10648-019-09474-4","https://www.scopus.com/inward/record.uri?eid=2-s2.0-85061052141&doi=10.1007%2fs10648-019-09474-4&partnerID=40&md5=7610ca0a8dfa35904e87c01d92876c5d","University of York","Leppink, J.; University of YorkUnited Kingdom; email: hyjl17@hyms.ac.uk","English",Editorial,"All Open Access, Hybrid Gold",Scopus
"Revision and new species of the African genus Mischogyne (Annonaceae)",2019,"Kew Bulletin","10.1007/s12225-019-9804-7","https://www.scopus.com/inward/record.uri?eid=2-s2.0-85068778134&doi=10.1007%2fs12225-019-9804-7&partnerID=40&md5=36a91b5c192422594b26684392fb50b9","Leverhulme Trust; Australian Research Council; Royal Botanical Gardens, Kew","Gosline, G.; Royal Botanic Gardens, United Kingdom; email: g.gosline@kew.org","English",Article,"All Open Access, Hybrid Gold, Green",Scopus
"A Semi-Supervised Learning Approach for Tackling Twitter Spam Drift",2019,"International Journal of Computational Intelligence and Applications","10.1142/S146902681950010X","https://www.scopus.com/inward/record.uri?eid=2-s2.0-85067298609&doi=10.1142%2fS146902681950010X&partnerID=40&md5=e15073cf5115bad659d680da40f88525",,"Issac, B.; Computing and Information Sciences, United Kingdom; email: bissac@ieee.org","English",Article,"All Open Access, Green",Scopus
